Job Title,Rating,Company Name,Location,Headquarters,Size,Founded,Type of ownership,Industry,Sector,Competitors,Average Salary,Average Revenue,Processed_JD
Research Scientist,4.5,Bank Negara Indonesia (BNI),Batu,Payakumbuh,10001+ employees,2005,Company - Partnership,Banking,Finance,"Bank Central Asia (BCA), Bank Mandiri, Bank Rakyat Indonesia (BRI)",1446.0,17137.9,"Join us as a Research Scientist. Required skills: Machine Learning, R, Data Analysis. Duties: Publish research findings, Collaborate with other scientists, Develop new methodologies."
Web Developer,2.7,Ciputra Development,Work From Home,Dumai,10001+ employees,2003,Company - Limited Liability Partnership (LLP),Real Estate,Real Estate,,918.9,11704.5,"We need a Web Developer proficient in CSS, Node.js, JavaScript. Responsibilities: Collaborate with designers, Ensure website performance, Work with HTML, CSS, and JavaScript."
Scrum Master,4.4,Telekomunikasi Selular (Telkomsel),Salatiga,Bau-Bau,10001+ employees,2009,Company - Partnership,Telecommunications,Telecommunications,"XL Axiata, PT Telkom Indonesia, Indosat Ooredoo",1320.7,36902.6,"We are looking for a Scrum Master skilled in Team Collaboration, Facilitation, Project Management. Responsibilities include Remove obstacles, Ensure team productivity, Support agile teams."
Graphic Designer,4.9,Alfamart,Tebing Tinggi,Pekalongan,1001 to 5000 employees,1990,Company - Limited Partnership (LP),Retail,Retail,"Indomaret, Matahari Department Store",148.3,13874.0,"Seeking a Graphic Designer proficient in Graphic Design, Illustrator, Adobe Photoshop. Responsibilities: Develop branding materials, Collaborate with marketing teams, Create visual designs."
Big Data Specialist,4.1,Bank Rakyat Indonesia (BRI),Sukabumi,Serang,1001 to 5000 employees,2010,Company - Joint Venture,Banking,Finance,"Bank Mandiri, Bank Central Asia (BCA), Bank Negara Indonesia (BNI)",315.9,69848.2,"We are looking for a Big Data Specialist skilled in Python, Big Data, NoSQL. Responsibilities include Work with Hadoop and Spark, Develop big data solutions, Manage and analyze large datasets."
Scrum Master,3.2,GoJek,Jambi,Manado,5001 to 10000 employees,1999,Company - Professional Corporation (PC),E-commerce,Technology,"Traveloka, Bukalapak, Tokopedia",742.2,43259.7,"We are looking for a Scrum Master skilled in Project Management, Scrum, Agile. Responsibilities include Remove obstacles, Support agile teams, Facilitate scrum processes."
Research Scientist,4.9,Astra International,Tual,Padang Sidempuan,10001+ employees,2009,Company - Corporation (C Corp),Automotive,Transportation,"Garuda Indonesia, Blue Bird Group",57.2,91273.0,"Join us as a Research Scientist. Required skills: Data Analysis, R, Python. Duties: Conduct research and experiments, Publish research findings, Develop new methodologies."
Agile Project Manager,3.9,Indomaret,Palopo,Sungai Penuh,5001 to 10000 employees,1992,Company - Subsidiary,Retail,Retail,"Matahari Department Store, Alfamart",1075.8,79055.1,"We need an Agile Project Manager with skills in Agile, Communication, Project Management. Main tasks: Manage agile projects, Collaborate with agile teams, Ensure project delivery."
Web Application Developer,4.2,Ciputra Development,Banjarmasin,Sungai Penuh,10001+ employees,2013,Company - Limited Liability Partnership (LLP),Real Estate,Real Estate,,434.1,10555.7,"We are looking for a Web Application Developer skilled in HTML, JavaScript, CSS. Responsibilities include Ensure application security, Optimize web application performance, Develop web applications."
Machine Learning Engineer,3.6,PLN (Perusahaan Listrik Negara),Batu,Cimahi,1001 to 5000 employees,1995,Company - Holding,Energy,Energy,"Bumi Resources, Pertamina",1418.5,82783.0,"Join our team as a Machine Learning Engineer. Skills required: Scikit-Learn, NLP, Python. Responsibilities: Work with TensorFlow and PyTorch, Collaborate with data scientists, Optimize ML algorithms."
Data Analyst,3.5,Telekomunikasi Selular (Telkomsel),Palembang,Lhokseumawe,5001 to 10000 employees,1996,Company - Professional Corporation (PC),Telecommunications,Telecommunications,"PT Telkom Indonesia, Indosat Ooredoo, XL Axiata",308.6,23328.7,"Seeking a Data Analyst proficient in Power BI, Excel, SQL. Responsibilities include Create reports and dashboards, Support data-driven decision making, Analyze business data."
Agile Project Manager,2.7,PT Telkom Indonesia,Jakarta,Ternate,5001 to 10000 employees,2002,Company - Limited Partnership (LP),Telecommunications,Telecommunications,"Indosat Ooredoo, XL Axiata, Telekomunikasi Selular (Telkomsel)",32.5,44878.1,"We need an Agile Project Manager with skills in Communication, Agile, Leadership. Main tasks: Collaborate with agile teams, Facilitate agile processes, Manage agile projects."
JavaScript Developer,4.9,Pertamina,Sawah Lunto,Ternate,10001+ employees,1990,Company - Joint Venture,Oil and Gas,Energy,"PLN (Perusahaan Listrik Negara), Bumi Resources",491.8,64936.9,"Hiring a JavaScript Developer proficient in JavaScript, Angular, Node.js. Responsibilities: Work with frameworks like React and Node.js, Develop applications using JavaScript, Ensure code quality."
AI Research Scientist,2.7,Bank Mandiri,Langsa,Tidore Kepulauan,5001 to 10000 employees,1998,Company - Government,Banking,Finance,"Bank Negara Indonesia (BNI), Bank Central Asia (BCA), Bank Rakyat Indonesia (BRI)",352.0,30120.5,"We need an AI Research Scientist with skills in Machine Learning, Algorithms, Python. Main tasks: Develop new AI algorithms, Collaborate with other researchers, Conduct AI research."
Data Analyst,3.2,Bank Mandiri,Blitar,Sabang,1001 to 5000 employees,1994,Company - Sole Proprietorship,Banking,Finance,"Bank Central Asia (BCA), Bank Rakyat Indonesia (BRI), Bank Negara Indonesia (BNI)",123.3,26334.3,"Seeking a Data Analyst proficient in SQL, Power BI, Tableau. Responsibilities include Identify trends and patterns, Work with SQL and Excel, Support data-driven decision making."
Deep Learning Engineer,4.4,Sampoerna,Cilegon,Padang Panjang,5001 to 10000 employees,1994,Company - Joint Venture,Tobacco,Consumer Goods,"Indofood, Unilever Indonesia, Gudang Garam",1298.2,26772.1,"Hiring a Deep Learning Engineer experienced with Python, Deep Learning, TensorFlow. You will be responsible for Collaborate with data scientists, Work with TensorFlow and Keras, Develop deep learning models."
Data Scientist,3.8,GoJek,Bukittinggi,Yogyakarta,10001+ employees,1991,Company - Holding,E-commerce,Technology,"Traveloka, Tokopedia, Bukalapak",467.4,29594.9,"We are looking for a Data Scientist to join our team. Requirements: Experience in Python, R, Machine Learning. Responsibilities: Analyze data to drive insights, Communicate findings to stakeholders, Collaborate with cross-functional teams."
Interaction Designer,4.2,Bukalapak,Padang Panjang,Palembang,10001+ employees,2002,Company - Holding,E-commerce,Technology,"Tokopedia, Traveloka, GoJek",686.1,83973.0,"We are looking for an Interaction Designer skilled in Interaction Design, UI Design, Prototyping. Responsibilities include Ensure interaction quality, Design interactive experiences, Create prototypes."
Brand Designer,2.5,Djarum,Bandar Lampung,Pagar Alam,1001 to 5000 employees,1990,Company - Corporation (C Corp),Tobacco,Consumer Goods,"Indofood, Unilever Indonesia, Sampoerna",1391.9,9229.2,"Hiring a Brand Designer proficient in Adobe Creative Suite, Visual Design, Graphic Design. Responsibilities: Collaborate with marketing teams, Ensure brand consistency, Work with design tools."
Data Analyst,3.6,Lippo Group,Tanjungbalai,Ternate,5001 to 10000 employees,2010,Company - Non-profit,Conglomerate,Conglomerate,Sinar Mas Group,31.4,26125.7,"Seeking a Data Analyst proficient in Power BI, Excel, SQL. Responsibilities include Analyze business data, Identify trends and patterns, Create reports and dashboards."
Technical Project Manager,4.6,GoJek,Yogyakarta,Salatiga,10001+ employees,1994,Company - Government,E-commerce,Technology,"Bukalapak, Tokopedia, Traveloka",631.4,65480.3,"Seeking a Technical Project Manager proficient in Project Management, Leadership, Scrum. Responsibilities include Manage technical projects, Work with cross-functional teams, Communicate with stakeholders."
Computer Vision Engineer,4.1,Blue Bird Group,Tarakan,Surakarta,5001 to 10000 employees,2009,Company - Subsidiary,Transportation,Transportation,"Garuda Indonesia, Astra International",599.9,22943.5,"We are looking for a Computer Vision Engineer skilled in OpenCV, Image Processing, Python. Responsibilities include Develop computer vision models, Work with image data, Use OpenCV and TensorFlow."
Motion Graphics Designer,4.3,Blue Bird Group,Pariaman,Balikpapan,5001 to 10000 employees,2011,Company - Limited Partnership (LP),Transportation,Transportation,"Garuda Indonesia, Astra International",766.6,14956.8,"Join us as a Motion Graphics Designer. Required skills: Animation, Creativity, After Effects. Duties: Work with animation tools, Collaborate with video production teams, Develop visual content."
Back-end Developer,4.5,Djarum,Padang Panjang,Bitung,1001 to 5000 employees,2003,Company - Public,Tobacco,Consumer Goods,"Sampoerna, Unilever Indonesia, Indofood",908.7,30365.2,"Hiring a Back-end Developer experienced with Node.js, SQL, Python. Responsibilities: Develop server-side logic, Ensure application performance, Work with databases."
Front-end Developer,2.8,Traveloka,Gunungsitoli,Padang Sidempuan,5001 to 10000 employees,2013,Company - Private,E-commerce,Technology,"GoJek, Tokopedia, Bukalapak",317.3,78743.9,"Seeking a Front-end Developer with skills in Vue.js, HTML, CSS. Responsibilities: Collaborate with back-end developers, Ensure responsive design, Optimize front-end performance."
UX Designer,5.0,Sinar Mas Group,Bontang,Bontang,5001 to 10000 employees,2001,Company - Private,Conglomerate,Conglomerate,Lippo Group,842.4,99727.9,"We need a UX Designer with skills in Adobe XD, Wireframing, Prototyping. Main tasks: Design user experiences, Collaborate with developers, Ensure usability."
Data Mining Engineer,4.0,XL Axiata,Sabang,Pariaman,1001 to 5000 employees,2000,Company - Limited Partnership (LP),Telecommunications,Telecommunications,"Indosat Ooredoo, PT Telkom Indonesia, Telekomunikasi Selular (Telkomsel)",524.7,87251.4,"Seeking a Data Mining Engineer proficient in R, SQL, Python. Responsibilities include Provide actionable insights, Analyze large datasets, Optimize algorithms."
Robotics Engineer,2.5,Indosat Ooredoo,Depok,Blitar,1001 to 5000 employees,2013,Company - Holding,Telecommunications,Telecommunications,"XL Axiata, Telekomunikasi Selular (Telkomsel), PT Telkom Indonesia",572.2,4866.1,"Seeking a Robotics Engineer proficient in Python, Robotics, ROS. Responsibilities include Work with control systems, Program robots, Collaborate with other engineers."
UI Designer,4.3,Unilever Indonesia,Jayapura,Bukittinggi,5001 to 10000 employees,1997,Company - Limited Partnership (LP),Consumer Goods,Consumer Goods,"Gudang Garam, Djarum, Indofood",1252.4,60206.5,"Hiring a UI Designer experienced with Figma, Prototyping, UI Design. Responsibilities: Ensure design consistency, Design user interfaces, Work with design tools."
UI Designer,4.5,Bukalapak,Cilegon,Banda Aceh,5001 to 10000 employees,2001,Company - Government,E-commerce,Technology,"GoJek, Traveloka, Tokopedia",1078.4,52928.5,"Hiring a UI Designer experienced with Figma, Sketch, Prototyping. Responsibilities: Design user interfaces, Collaborate with developers, Ensure design consistency."
Technical Project Manager,4.5,Pertamina,Magelang,Palangka Raya,10001+ employees,1998,Company - Public,Oil and Gas,Energy,"Bumi Resources, PLN (Perusahaan Listrik Negara)",617.6,53750.6,"Seeking a Technical Project Manager proficient in Project Management, Leadership, Agile. Responsibilities include Manage technical projects, Work with cross-functional teams, Ensure project delivery."
Computer Vision Engineer,4.1,Sinar Mas Group,Jambi,Makassar,5001 to 10000 employees,2011,Company - Limited Liability Company (LLC),Conglomerate,Conglomerate,Lippo Group,271.9,92456.9,"We are looking for a Computer Vision Engineer skilled in OpenCV, Deep Learning, Python. Responsibilities include Use OpenCV and TensorFlow, Develop computer vision models, Collaborate with data scientists."
Computer Vision Engineer,4.5,Telekomunikasi Selular (Telkomsel),Jambi,Semarang,10001+ employees,2012,Company - Joint Venture,Telecommunications,Telecommunications,"XL Axiata, PT Telkom Indonesia, Indosat Ooredoo",1404.9,16177.0,"We are looking for a Computer Vision Engineer skilled in Python, OpenCV, Computer Vision. Responsibilities include Collaborate with data scientists, Optimize image processing algorithms, Develop computer vision models."
Front-end Developer,4.0,Indosat Ooredoo,Bengkulu,Pasuruan,5001 to 10000 employees,1990,Company - Professional Corporation (PC),Telecommunications,Telecommunications,"PT Telkom Indonesia, XL Axiata, Telekomunikasi Selular (Telkomsel)",644.7,13601.5,"Seeking a Front-end Developer with skills in React, HTML, Vue.js. Responsibilities: Collaborate with back-end developers, Optimize front-end performance, Develop user interfaces."
Motion Graphics Designer,4.1,Bank Central Asia (BCA),Blitar,Jakarta,5001 to 10000 employees,2000,Company - Holding,Banking,Finance,"Bank Mandiri, Bank Rakyat Indonesia (BRI), Bank Negara Indonesia (BNI)",129.9,43208.5,"Join us as a Motion Graphics Designer. Required skills: Creativity, Motion Graphics, Cinema 4D. Duties: Work with animation tools, Ensure animation quality, Create motion graphics."
Technical Project Manager,3.4,Traveloka,Lhokseumawe,Bandung,5001 to 10000 employees,2010,Company - Limited Liability Partnership (LLP),E-commerce,Technology,"Tokopedia, GoJek, Bukalapak",1052.8,70563.1,"Seeking a Technical Project Manager proficient in Scrum, Technical Background, Project Management. Responsibilities include Ensure project delivery, Manage project timelines, Communicate with stakeholders."
Data Mining Engineer,2.9,Garuda Indonesia,Sabang,Kotamobagu,5001 to 10000 employees,2006,Company - Limited Liability Partnership (LLP),Airlines,Transportation,"Astra International, Blue Bird Group",1274.7,38938.8,"Seeking a Data Mining Engineer proficient in Algorithms, R, Data Mining. Responsibilities include Work with data scientists, Provide actionable insights, Develop data mining models."
JavaScript Developer,3.3,GoJek,Bogor,Metro,1001 to 5000 employees,1990,Company - Cooperative,E-commerce,Technology,"Tokopedia, Traveloka, Bukalapak",1043.5,30120.5,"Hiring a JavaScript Developer proficient in Angular, React, Node.js. Responsibilities: Develop applications using JavaScript, Work with frameworks like React and Node.js, Collaborate with other developers."
UI Designer,3.0,Sampoerna,Singkawang,Pagar Alam,10001+ employees,1998,Company - Non-profit,Tobacco,Consumer Goods,"Indofood, Gudang Garam, Djarum",1158.5,15511.2,"Hiring a UI Designer experienced with Figma, Sketch, UI Design. Responsibilities: Design user interfaces, Work with design tools, Create prototypes."
Computer Vision Engineer,3.7,Blue Bird Group,Batu,Depok,5001 to 10000 employees,2007,Company - S Corporation (S Corp),Transportation,Transportation,"Garuda Indonesia, Astra International",33.2,32442.2,"We are looking for a Computer Vision Engineer skilled in OpenCV, Deep Learning, Image Processing. Responsibilities include Use OpenCV and TensorFlow, Optimize image processing algorithms, Work with image data."
Graphic Designer,2.9,Indosat Ooredoo,Gorontalo,Prabumulih,5001 to 10000 employees,1998,Company - Limited Liability Partnership (LLP),Telecommunications,Telecommunications,"XL Axiata, Telekomunikasi Selular (Telkomsel), PT Telkom Indonesia",90.6,8233.3,"Seeking a Graphic Designer proficient in Graphic Design, Creativity, Illustrator. Responsibilities: Develop branding materials, Work with design tools, Create visual designs."
NLP Engineer (Natural Language Processing),4.0,Garuda Indonesia,Blitar,Medan,5001 to 10000 employees,1990,Company - Non-profit,Airlines,Transportation,"Astra International, Blue Bird Group",869.4,99758.3,"Join us as an NLP Engineer. Required skills: NLTK, SpaCy, NLP. Duties: Use NLP libraries, Collaborate with linguists, Deploy NLP solutions."
Technical Project Manager,3.0,Sinar Mas Group,Tomohon,Batam,1001 to 5000 employees,2007,Company - Corporation (C Corp),Conglomerate,Conglomerate,Lippo Group,843.5,1853.8,"Seeking a Technical Project Manager proficient in Project Management, Leadership, Scrum. Responsibilities include Manage project timelines, Work with cross-functional teams, Ensure project delivery."
Scrum Master,4.8,Bumi Resources,Batam,Jayapura,1001 to 5000 employees,2010,Company - Subsidiary,Mining,Energy,"Pertamina, PLN (Perusahaan Listrik Negara)",60.0,10439.8,"We are looking for a Scrum Master skilled in Scrum, Agile, Team Collaboration. Responsibilities include Remove obstacles, Ensure team productivity, Facilitate scrum processes."
Data Mining Engineer,2.9,Indosat Ooredoo,Denpasar,Banda Aceh,10001+ employees,2008,Company - Limited Liability Company (LLC),Telecommunications,Telecommunications,"PT Telkom Indonesia, Telekomunikasi Selular (Telkomsel), XL Axiata",806.5,86282.5,"Seeking a Data Mining Engineer proficient in Algorithms, SQL, Python. Responsibilities include Work with data scientists, Optimize algorithms, Develop data mining models."
Scrum Master,2.8,Kalbe Farma,Kendari,Tasikmalaya,10001+ employees,2012,Company - Non-profit,Pharmaceuticals,Healthcare,,272.6,12997.6,"We are looking for a Scrum Master skilled in Agile, Team Collaboration, Project Management. Responsibilities include Remove obstacles, Support agile teams, Communicate with stakeholders."
JavaScript Developer,4.5,PLN (Perusahaan Listrik Negara),Banda Aceh,Makassar,1001 to 5000 employees,2012,Company - Corporation (C Corp),Energy,Energy,"Pertamina, Bumi Resources",783.2,29864.3,"Hiring a JavaScript Developer proficient in Node.js, Angular, React. Responsibilities: Work with frameworks like React and Node.js, Develop applications using JavaScript, Optimize JavaScript performance."
Interaction Designer,4.9,Unilever Indonesia,Tidore Kepulauan,Pematang Siantar,10001+ employees,1995,Company - Joint Venture,Consumer Goods,Consumer Goods,"Sampoerna, Indofood, Djarum",1079.4,89248.3,"We are looking for an Interaction Designer skilled in User Testing, Interaction Design, Adobe XD. Responsibilities include Ensure interaction quality, Design interactive experiences, Work with design tools."
Data Engineer,3.8,Bumi Resources,Bengkulu,Banjarbaru,1001 to 5000 employees,1999,Company - Corporation (C Corp),Mining,Energy,"PLN (Perusahaan Listrik Negara), Pertamina",222.8,53505.4,"Hiring a Data Engineer experienced with SQL, Hadoop, Big Data. You will be responsible for Collaborate with data scientists, Work with big data technologies, Ensure data quality and integrity."
UI Designer,3.4,Pertamina,Dumai,Tidore Kepulauan,1001 to 5000 employees,2009,Company - Limited Liability Partnership (LLP),Oil and Gas,Energy,"PLN (Perusahaan Listrik Negara), Bumi Resources",154.8,69848.2,"Hiring a UI Designer experienced with Sketch, Figma, Prototyping. Responsibilities: Design user interfaces, Ensure design consistency, Collaborate with developers."
Web Application Developer,2.9,Bumi Resources,Mataram,Pontianak,10001+ employees,2001,Company - Professional Corporation (PC),Mining,Energy,"PLN (Perusahaan Listrik Negara), Pertamina",401.8,71528.5,"We are looking for a Web Application Developer skilled in HTML, Web Development, APIs. Responsibilities include Work with JavaScript and APIs, Optimize web application performance, Collaborate with designers."
Data Mining Engineer,4.8,Telekomunikasi Selular (Telkomsel),Palangka Raya,Palu,10001+ employees,2007,Company - Partnership,Telecommunications,Telecommunications,"PT Telkom Indonesia, Indosat Ooredoo, XL Axiata",1423.9,13738.9,"Seeking a Data Mining Engineer proficient in Data Mining, Algorithms, SQL. Responsibilities include Optimize algorithms, Develop data mining models, Analyze large datasets."
UI/UX Developer,2.8,Astra International,Bogor,Denpasar,10001+ employees,2012,Company - Professional Corporation (PC),Automotive,Transportation,"Blue Bird Group, Garuda Indonesia",698.8,9791.8,"Join us as a UI/UX Developer. Required skills: Sketch, UI Design, UX Research. Duties: Work with design tools, Create prototypes, Design user interfaces and experiences."
Data Analyst,3.0,Pertamina,Binjai,Tidore Kepulauan,1001 to 5000 employees,2008,Company - Corporation (C Corp),Oil and Gas,Energy,"PLN (Perusahaan Listrik Negara), Bumi Resources",1010.5,27875.8,"Seeking a Data Analyst proficient in SQL, Power BI, Tableau. Responsibilities include Identify trends and patterns, Analyze business data, Create reports and dashboards."
Front-end Developer,2.6,Gudang Garam,Batu,Sungai Penuh,1001 to 5000 employees,1992,Company - Partnership,Tobacco,Consumer Goods,"Sampoerna, Unilever Indonesia, Djarum",281.3,35515.2,"Seeking a Front-end Developer with skills in CSS, Vue.js, React. Responsibilities: Work with HTML, CSS, and JavaScript, Ensure responsive design, Optimize front-end performance."
Front-end Developer,3.8,Bank Mandiri,Ambon,Sorong,5001 to 10000 employees,2007,Company - Public,Banking,Finance,"Bank Negara Indonesia (BNI), Bank Central Asia (BCA), Bank Rakyat Indonesia (BRI)",60.0,70184.4,"Seeking a Front-end Developer with skills in CSS, HTML, JavaScript. Responsibilities: Work with HTML, CSS, and JavaScript, Collaborate with back-end developers, Develop user interfaces."
IT Project Manager,2.8,Bank Rakyat Indonesia (BRI),Tual,Lhokseumawe,1001 to 5000 employees,2002,Company - Professional Corporation (PC),Banking,Finance,"Bank Central Asia (BCA), Bank Mandiri, Bank Negara Indonesia (BNI)",359.7,76668.3,"Join our team as an IT Project Manager. Skills required: Leadership, Scrum, Agile. Responsibilities: Manage IT projects, Work with IT teams, Manage project budgets."
Program Manager,2.9,Bank Mandiri,Bukittinggi,Ternate,1001 to 5000 employees,2000,Company - Corporation (C Corp),Banking,Finance,"Bank Central Asia (BCA), Bank Rakyat Indonesia (BRI), Bank Negara Indonesia (BNI)",708.3,59550.7,"Join us as a Program Manager. Required skills: Scrum, Program Management, Leadership. Duties: Manage program budgets, Manage programs, Ensure program delivery."
Interaction Designer,4.3,Lippo Group,Kupang,Bogor,1001 to 5000 employees,2006,Company - Holding,Conglomerate,Conglomerate,Sinar Mas Group,117.8,19870.8,"We are looking for an Interaction Designer skilled in User Testing, Adobe XD, Prototyping. Responsibilities include Work with design tools, Collaborate with developers, Create prototypes."
Full-stack Developer,3.5,Pertamina,Tebing Tinggi,Tebing Tinggi,1001 to 5000 employees,2004,Company - Partnership,Oil and Gas,Energy,"Bumi Resources, PLN (Perusahaan Listrik Negara)",239.4,2427.4,"We need a Full-stack Developer with skills in JavaScript, React, CSS. Main tasks: Ensure full-stack performance, Develop both front-end and back-end, Work with HTML, CSS, JavaScript, and server-side languages."
Reinforcement Learning Specialist,3.5,Indomaret,Dumai,Pontianak,10001+ employees,2003,Company - Public,Retail,Retail,"Alfamart, Matahari Department Store",1362.2,45414.7,"Join our team as a Reinforcement Learning Specialist. Skills required: TensorFlow, Machine Learning, Reinforcement Learning. Responsibilities: Work with TensorFlow and PyTorch, Collaborate with data scientists, Conduct experiments."
Data Analyst,2.8,Tokopedia,Banda Aceh,Solok,1001 to 5000 employees,2009,Company - Subsidiary,E-commerce,Technology,"Traveloka, Bukalapak, GoJek",392.1,17624.6,"Seeking a Data Analyst proficient in Power BI, SQL, Data Visualization. Responsibilities include Work with SQL and Excel, Identify trends and patterns, Support data-driven decision making."
Technical Project Manager,4.1,Djarum,Banjar,Magelang,1001 to 5000 employees,1999,Company - S Corporation (S Corp),Tobacco,Consumer Goods,"Sampoerna, Indofood, Gudang Garam",47.9,19078.1,"Seeking a Technical Project Manager proficient in Scrum, Technical Background, Leadership. Responsibilities include Work with cross-functional teams, Manage project timelines, Communicate with stakeholders."
Technical Project Manager,3.1,Bank Rakyat Indonesia (BRI),Kotamobagu,Jayapura,5001 to 10000 employees,1997,Company - Private,Banking,Finance,"Bank Negara Indonesia (BNI), Bank Central Asia (BCA), Bank Mandiri",859.3,69848.2,"Seeking a Technical Project Manager proficient in Scrum, Leadership, Project Management. Responsibilities include Manage project timelines, Communicate with stakeholders, Work with cross-functional teams."
Research Scientist,3.2,Bukalapak,Jambi,Tanjungbalai,5001 to 10000 employees,2001,Company - Public,E-commerce,Technology,"Traveloka, Tokopedia, GoJek",902.7,10770.1,"Join us as a Research Scientist. Required skills: Data Analysis, Python, R. Duties: Collaborate with other scientists, Publish research findings, Analyze experimental data."
Computer Vision Engineer,3.6,Telekomunikasi Selular (Telkomsel),Gunungsitoli,Bitung,1001 to 5000 employees,2008,Company - Professional Corporation (PC),Telecommunications,Telecommunications,"Indosat Ooredoo, XL Axiata, PT Telkom Indonesia",1422.2,30.8,"We are looking for a Computer Vision Engineer skilled in Python, OpenCV, Computer Vision. Responsibilities include Use OpenCV and TensorFlow, Collaborate with data scientists, Develop computer vision models."
Full-stack Developer,4.9,Telekomunikasi Selular (Telkomsel),Pematang Siantar,Gunungsitoli,10001+ employees,2012,Company - Non-profit,Telecommunications,Telecommunications,"PT Telkom Indonesia, XL Axiata, Indosat Ooredoo",321.7,66727.7,"We need a Full-stack Developer with skills in HTML, React, CSS. Main tasks: Work with HTML, CSS, JavaScript, and server-side languages, Ensure full-stack performance, Collaborate with designers and developers."
