Job Title,Rating,Company Name,Location,Headquarters,Size,Founded,Type of ownership,Industry,Sector,Competitors,Average Salary,Average Revenue,Processed_JD
Full-stack Developer,4.5,Tokopedia,Mojokerto,Samarinda,10001+ employees,2013,Company - Limited Partnership (LP),E-commerce,Technology,"GoJek, Bukalapak, Traveloka",1404.9,80339.2,"We need a Full-stack Developer with skills in JavaScript, Node.js, HTML. Main tasks: Ensure full-stack performance, Develop both front-end and back-end, Collaborate with designers and developers."
Agile Project Manager,3.0,Garuda Indonesia,Bandar Lampung,Surakarta,1001 to 5000 employees,1990,Company - Professional Corporation (PC),Airlines,Transportation,"Blue Bird Group, Astra International",1020.7,79127.7,"We need an Agile Project Manager with skills in Scrum, Communication, Project Management. Main tasks: Facilitate agile processes, Ensure project delivery, Collaborate with agile teams."
NLP Engineer (Natural Language Processing),3.8,Sampoerna,Parepare,Blitar,10001+ employees,2004,Company - Non-profit,Tobacco,Consumer Goods,"Gudang Garam, Indofood, Unilever Indonesia",672.2,78420.5,"Join us as an NLP Engineer. Required skills: SpaCy, NLTK, Python. Duties: Deploy NLP solutions, Work with text data, Collaborate with linguists."
Full-stack Developer,2.7,Sampoerna,Batu,Sukabumi,5001 to 10000 employees,1993,Company - Holding,Tobacco,Consumer Goods,"Gudang Garam, Indofood, Djarum",929.2,21138.4,"We need a Full-stack Developer with skills in JavaScript, CSS, HTML. Main tasks: Develop both front-end and back-end, Optimize full-stack applications, Collaborate with designers and developers."
UI Designer,4.6,Bukalapak,Tidore Kepulauan,Binjai,10001+ employees,2002,Company - Sole Proprietorship,E-commerce,Technology,"Tokopedia, GoJek, Traveloka",1075.6,6236.4,"Hiring a UI Designer experienced with Adobe XD, UI Design, Figma. Responsibilities: Work with design tools, Collaborate with developers, Create prototypes."
Data Mining Engineer,3.1,Telekomunikasi Selular (Telkomsel),Prabumulih,Prabumulih,5001 to 10000 employees,1995,Company - Professional Corporation (PC),Telecommunications,Telecommunications,"PT Telkom Indonesia, XL Axiata, Indosat Ooredoo",684.1,12997.6,"Seeking a Data Mining Engineer proficient in Python, SQL, Data Mining. Responsibilities include Develop data mining models, Work with data scientists, Optimize algorithms."
Graphic Designer,3.7,Garuda Indonesia,Tangerang,Pontianak,1001 to 5000 employees,2011,Company - Non-profit,Airlines,Transportation,"Astra International, Blue Bird Group",38.0,12632.1,"Seeking a Graphic Designer proficient in Creativity, Illustrator, Adobe Photoshop. Responsibilities: Work with design tools, Create visual designs, Ensure design quality."
Full-stack Developer,3.1,Kalbe Farma,Palopo,Banda Aceh,10001+ employees,1999,Company - Cooperative,Pharmaceuticals,Healthcare,,632.6,26475.7,"We need a Full-stack Developer with skills in Node.js, JavaScript, React. Main tasks: Ensure full-stack performance, Optimize full-stack applications, Develop both front-end and back-end."
Product Manager,2.6,Indomaret,Palu,Kotamobagu,1001 to 5000 employees,2006,Company - Government,Retail,Retail,"Alfamart, Matahari Department Store",1190.5,19743.6,"Hiring a Product Manager experienced with Scrum, Product Management, Product Development. You will be responsible for Manage product lifecycle, Define product vision, Communicate with stakeholders."
Machine Learning Engineer,4.0,Indofood,Magelang,Jambi,10001+ employees,2008,Company - S Corporation (S Corp),Food and Beverage,Consumer Goods,"Sampoerna, Gudang Garam, Djarum",1117.9,68185.7,"Join our team as a Machine Learning Engineer. Skills required: Scikit-Learn, Deep Learning, TensorFlow. Responsibilities: Collaborate with data scientists, Deploy ML solutions, Develop machine learning models."
Reinforcement Learning Specialist,4.3,Ciputra Development,Tegal,Padang Panjang,5001 to 10000 employees,2011,Company - Private,Real Estate,Real Estate,,789.2,91893.3,"Join our team as a Reinforcement Learning Specialist. Skills required: Machine Learning, Algorithms, TensorFlow. Responsibilities: Conduct experiments, Optimize RL algorithms, Work with TensorFlow and PyTorch."
Data Scientist,3.6,Bank Negara Indonesia (BNI),Cimahi,Samarinda,10001+ employees,2005,Company - Subsidiary,Banking,Finance,"Bank Rakyat Indonesia (BRI), Bank Mandiri, Bank Central Asia (BCA)",1493.8,64338.2,"We are looking for a Data Scientist to join our team. Requirements: Experience in Data Analysis, R, SQL. Responsibilities: Analyze data to drive insights, Develop predictive models, Work with large datasets."
UX Designer,3.2,Bank Central Asia (BCA),Tanjungbalai,Sukabumi,1001 to 5000 employees,2013,Company - Limited Liability Company (LLC),Banking,Finance,"Bank Rakyat Indonesia (BRI), Bank Mandiri, Bank Negara Indonesia (BNI)",1453.2,3371.9,"We need a UX Designer with skills in Sketch, UX Research, Adobe XD. Main tasks: Design user experiences, Create wireframes and prototypes, Collaborate with developers."
Motion Graphics Designer,4.8,Garuda Indonesia,Jambi,Tangerang,5001 to 10000 employees,2010,Company - Non-profit,Airlines,Transportation,"Astra International, Blue Bird Group",571.7,32413.2,"Join us as a Motion Graphics Designer. Required skills: Creativity, After Effects, Animation. Duties: Work with animation tools, Create motion graphics, Develop visual content."
Scrum Master,2.6,Unilever Indonesia,Pontianak,Bogor,1001 to 5000 employees,1995,Company - Sole Proprietorship,Consumer Goods,Consumer Goods,"Sampoerna, Djarum, Gudang Garam",148.3,9568.8,"We are looking for a Scrum Master skilled in Scrum, Team Collaboration, Agile. Responsibilities include Communicate with stakeholders, Facilitate scrum processes, Remove obstacles."
Big Data Specialist,3.2,Telekomunikasi Selular (Telkomsel),Samarinda,Binjai,10001+ employees,2009,Company - Government,Telecommunications,Telecommunications,"Indosat Ooredoo, PT Telkom Indonesia, XL Axiata",108.5,24727.7,"We are looking for a Big Data Specialist skilled in NoSQL, Spark, Big Data. Responsibilities include Collaborate with data engineers, Manage and analyze large datasets, Ensure data scalability."
AI Research Scientist,4.5,Bank Mandiri,Pematang Siantar,Pematang Siantar,5001 to 10000 employees,1994,Company - Private,Banking,Finance,"Bank Negara Indonesia (BNI), Bank Central Asia (BCA), Bank Rakyat Indonesia (BRI)",287.6,40404.7,"We need an AI Research Scientist with skills in AI, Machine Learning, Algorithms. Main tasks: Publish research papers, Collaborate with other researchers, Conduct AI research."
NLP Engineer (Natural Language Processing),4.7,Kalbe Farma,Mojokerto,Sukabumi,10001+ employees,1997,Company - Limited Liability Partnership (LLP),Pharmaceuticals,Healthcare,,1400.2,42358.5,"Join us as an NLP Engineer. Required skills: SpaCy, NLTK, Text Mining. Duties: Work with text data, Use NLP libraries, Develop NLP models."
Scrum Master,3.4,Djarum,Cilegon,Blitar,10001+ employees,2008,Company - Limited Partnership (LP),Tobacco,Consumer Goods,"Gudang Garam, Sampoerna, Indofood",1014.9,5285.2,"We are looking for a Scrum Master skilled in Project Management, Team Collaboration, Agile. Responsibilities include Remove obstacles, Communicate with stakeholders, Ensure team productivity."
AI Research Scientist,4.8,Djarum,Pematang Siantar,Cilegon,5001 to 10000 employees,1996,Company - Subsidiary,Tobacco,Consumer Goods,"Gudang Garam, Unilever Indonesia, Sampoerna",1043.5,11179.9,"We need an AI Research Scientist with skills in AI, Research, Machine Learning. Main tasks: Develop new AI algorithms, Publish research papers, Collaborate with other researchers."
UI Designer,2.7,Garuda Indonesia,Banjarbaru,Tangerang Selatan,5001 to 10000 employees,2011,Company - Partnership,Airlines,Transportation,"Blue Bird Group, Astra International",816.3,60562.0,"Hiring a UI Designer experienced with Adobe XD, Prototyping, UI Design. Responsibilities: Design user interfaces, Work with design tools, Collaborate with developers."
Research Scientist,3.5,Traveloka,Pagar Alam,Palangka Raya,5001 to 10000 employees,1999,Company - Public,E-commerce,Technology,"Bukalapak, Tokopedia, GoJek",1284.9,98735.9,"Join us as a Research Scientist. Required skills: Data Analysis, Python, Statistics. Duties: Collaborate with other scientists, Develop new methodologies, Publish research findings."
UX Designer,3.2,Gudang Garam,Padang,Lubuklinggau,5001 to 10000 employees,2008,Company - Partnership,Tobacco,Consumer Goods,"Indofood, Unilever Indonesia, Djarum",1175.8,51817.6,"We need a UX Designer with skills in Prototyping, Sketch, UX Research. Main tasks: Conduct user research, Ensure usability, Design user experiences."
Deep Learning Engineer,4.2,Indosat Ooredoo,Banjarmasin,Blitar,5001 to 10000 employees,2012,Company - Partnership,Telecommunications,Telecommunications,"XL Axiata, PT Telkom Indonesia, Telekomunikasi Selular (Telkomsel)",1137.6,46551.2,"Hiring a Deep Learning Engineer experienced with Python, Keras, Neural Networks. You will be responsible for Work with TensorFlow and Keras, Optimize neural networks, Develop deep learning models."
Graphic Designer,4.5,Unilever Indonesia,Tanjungpinang,Ternate,1001 to 5000 employees,2007,Company - Government,Consumer Goods,Consumer Goods,"Djarum, Sampoerna, Gudang Garam",205.0,45057.5,"Seeking a Graphic Designer proficient in Graphic Design, InDesign, Illustrator. Responsibilities: Ensure design quality, Develop branding materials, Collaborate with marketing teams."
Product Manager,3.9,Garuda Indonesia,Malang,Ternate,10001+ employees,2001,Company - Limited Liability Company (LLC),Airlines,Transportation,"Blue Bird Group, Astra International",1214.3,26089.3,"Hiring a Product Manager experienced with Product Management, Agile, Product Development. You will be responsible for Communicate with stakeholders, Define product vision, Manage product lifecycle."
Brand Designer,3.8,Bumi Resources,Padang Sidempuan,Serang,5001 to 10000 employees,1993,Company - Non-profit,Mining,Energy,"PLN (Perusahaan Listrik Negara), Pertamina",1360.9,45164.5,"Hiring a Brand Designer proficient in Graphic Design, Creativity, Adobe Creative Suite. Responsibilities: Collaborate with marketing teams, Work with design tools, Develop branding materials."
Data Analyst,3.4,Matahari Department Store,Lhokseumawe,Banjar,10001+ employees,2008,Company - Government,Retail,Retail,"Alfamart, Indomaret",100.4,13423.0,"Seeking a Data Analyst proficient in Tableau, Power BI, Excel. Responsibilities include Support data-driven decision making, Analyze business data, Identify trends and patterns."
Graphic Designer,3.3,Kalbe Farma,Bengkulu,Samarinda,1001 to 5000 employees,1992,Company - Non-profit,Pharmaceuticals,Healthcare,,620.8,2913.3,"Seeking a Graphic Designer proficient in Illustrator, Creativity, Adobe Photoshop. Responsibilities: Create visual designs, Work with design tools, Develop branding materials."
Data Analyst,2.9,Unilever Indonesia,Jayapura,Gunungsitoli,5001 to 10000 employees,2008,Company - Partnership,Consumer Goods,Consumer Goods,"Djarum, Sampoerna, Gudang Garam",1443.9,8255.5,"Seeking a Data Analyst proficient in Excel, Tableau, SQL. Responsibilities include Support data-driven decision making, Identify trends and patterns, Create reports and dashboards."
Scrum Master,3.5,Djarum,Yogyakarta,Bekasi,1001 to 5000 employees,1996,Company - S Corporation (S Corp),Tobacco,Consumer Goods,"Indofood, Sampoerna, Unilever Indonesia",1189.3,82603.8,"We are looking for a Scrum Master skilled in Scrum, Project Management, Team Collaboration. Responsibilities include Communicate with stakeholders, Facilitate scrum processes, Ensure team productivity."
Data Analyst,3.1,Bank Rakyat Indonesia (BRI),Palopo,Sabang,1001 to 5000 employees,2010,Company - Partnership,Banking,Finance,"Bank Negara Indonesia (BNI), Bank Central Asia (BCA), Bank Mandiri",195.5,6591.2,"Seeking a Data Analyst proficient in SQL, Tableau, Power BI. Responsibilities include Create reports and dashboards, Identify trends and patterns, Work with SQL and Excel."
Deep Learning Engineer,2.7,Matahari Department Store,Lubuklinggau,Sawah Lunto,1001 to 5000 employees,2008,Company - Public,Retail,Retail,"Alfamart, Indomaret",1028.4,85336.3,"Hiring a Deep Learning Engineer experienced with TensorFlow, Keras, Python. You will be responsible for Collaborate with data scientists, Optimize neural networks, Develop deep learning models."
AI Research Scientist,3.7,Bank Negara Indonesia (BNI),Depok,Tomohon,5001 to 10000 employees,1994,Company - S Corporation (S Corp),Banking,Finance,"Bank Central Asia (BCA), Bank Rakyat Indonesia (BRI), Bank Mandiri",1302.9,95608.8,"We need an AI Research Scientist with skills in Algorithms, AI, Research. Main tasks: Collaborate with other researchers, Develop new AI algorithms, Publish research papers."
UI Designer,4.3,Blue Bird Group,Tasikmalaya,Surabaya,5001 to 10000 employees,2002,Company - Holding,Transportation,Transportation,"Astra International, Garuda Indonesia",176.8,58871.5,"Hiring a UI Designer experienced with Figma, UI Design, Adobe XD. Responsibilities: Ensure design consistency, Create prototypes, Collaborate with developers."
Data Scientist,4.3,Pertamina,Padang,Cirebon,1001 to 5000 employees,2006,Company - Public,Oil and Gas,Energy,"Bumi Resources, PLN (Perusahaan Listrik Negara)",644.7,86924.3,"We are looking for a Data Scientist to join our team. Requirements: Experience in Machine Learning, SQL, R. Responsibilities: Communicate findings to stakeholders, Develop predictive models, Analyze data to drive insights."
JavaScript Developer,3.1,Bukalapak,Samarinda,Tegal,1001 to 5000 employees,2007,Company - Non-profit,E-commerce,Technology,"GoJek, Traveloka, Tokopedia",1145.3,9791.8,"Hiring a JavaScript Developer proficient in Vue.js, React, JavaScript. Responsibilities: Develop applications using JavaScript, Work with frameworks like React and Node.js, Optimize JavaScript performance."
Business Intelligence Analyst,3.7,Kalbe Farma,Sungai Penuh,Singkawang,1001 to 5000 employees,1992,Company - S Corporation (S Corp),Pharmaceuticals,Healthcare,,60.2,87252.2,"We need a Business Intelligence Analyst with skills in SQL, BI Tools, Analytics. Main tasks: Create and maintain dashboards, Analyze data trends, Work with business stakeholders."
NLP Engineer (Natural Language Processing),2.7,Traveloka,Binjai,Yogyakarta,1001 to 5000 employees,2005,Company - Corporation (C Corp),E-commerce,Technology,"Tokopedia, GoJek, Bukalapak",631.4,22693.0,"Join us as an NLP Engineer. Required skills: Python, NLP, Text Mining. Duties: Use NLP libraries, Develop NLP models, Work with text data."
JavaScript Developer,5.0,Garuda Indonesia,Tual,Pangkal Pinang,5001 to 10000 employees,2011,Company - Cooperative,Airlines,Transportation,"Blue Bird Group, Astra International",173.9,82378.5,"Hiring a JavaScript Developer proficient in Angular, Node.js, React. Responsibilities: Optimize JavaScript performance, Develop applications using JavaScript, Work with frameworks like React and Node.js."
AI Research Scientist,3.3,Garuda Indonesia,Jayapura,Bau-Bau,5001 to 10000 employees,2009,Company - Limited Partnership (LP),Airlines,Transportation,"Blue Bird Group, Astra International",1448.5,14918.9,"We need an AI Research Scientist with skills in Python, Algorithms, Research. Main tasks: Analyze experimental results, Develop new AI algorithms, Publish research papers."
Deep Learning Engineer,2.8,PLN (Perusahaan Listrik Negara),Payakumbuh,Medan,1001 to 5000 employees,1990,Company - Non-profit,Energy,Energy,"Pertamina, Bumi Resources",1055.0,54620.5,"Hiring a Deep Learning Engineer experienced with Python, Deep Learning, Neural Networks. You will be responsible for Work with TensorFlow and Keras, Deploy DL solutions, Develop deep learning models."
Brand Designer,2.5,Kalbe Farma,Tebing Tinggi,Bau-Bau,1001 to 5000 employees,2000,Company - Joint Venture,Pharmaceuticals,Healthcare,,684.4,34243.0,"Hiring a Brand Designer proficient in Creativity, Brand Strategy, Visual Design. Responsibilities: Develop branding materials, Create visual identities, Collaborate with marketing teams."
NLP Engineer (Natural Language Processing),4.0,Blue Bird Group,Sukabumi,Sabang,1001 to 5000 employees,2001,Company - Sole Proprietorship,Transportation,Transportation,"Astra International, Garuda Indonesia",706.2,64987.5,"Join us as an NLP Engineer. Required skills: SpaCy, NLP, NLTK. Duties: Deploy NLP solutions, Develop NLP models, Use NLP libraries."
JavaScript Developer,3.7,Garuda Indonesia,Surabaya,Pasuruan,1001 to 5000 employees,2009,Company - Non-profit,Airlines,Transportation,"Astra International, Blue Bird Group",1498.0,71528.5,"Hiring a JavaScript Developer proficient in Node.js, Vue.js, Angular. Responsibilities: Collaborate with other developers, Work with frameworks like React and Node.js, Optimize JavaScript performance."
Technical Project Manager,3.2,Indosat Ooredoo,Jambi,Salatiga,1001 to 5000 employees,2004,Company - Non-profit,Telecommunications,Telecommunications,"XL Axiata, PT Telkom Indonesia, Telekomunikasi Selular (Telkomsel)",842.4,50986.7,"Seeking a Technical Project Manager proficient in Technical Background, Project Management, Scrum. Responsibilities include Manage technical projects, Manage project timelines, Ensure project delivery."
Deep Learning Engineer,2.7,Unilever Indonesia,Sawah Lunto,Bontang,5001 to 10000 employees,1992,Company - Limited Liability Partnership (LLP),Consumer Goods,Consumer Goods,"Sampoerna, Indofood, Djarum",1460.8,91682.9,"Hiring a Deep Learning Engineer experienced with Deep Learning, Python, Keras. You will be responsible for Develop deep learning models, Work with TensorFlow and Keras, Collaborate with data scientists."
Scrum Master,3.7,PT Telkom Indonesia,Medan,Malang,1001 to 5000 employees,2009,Company - Cooperative,Telecommunications,Telecommunications,"Indosat Ooredoo, XL Axiata, Telekomunikasi Selular (Telkomsel)",568.4,35459.8,"We are looking for a Scrum Master skilled in Facilitation, Agile, Scrum. Responsibilities include Remove obstacles, Communicate with stakeholders, Support agile teams."
Computer Vision Engineer,4.6,Sinar Mas Group,Tual,Lhokseumawe,10001+ employees,1994,Company - Sole Proprietorship,Conglomerate,Conglomerate,Lippo Group,1452.7,14394.5,"We are looking for a Computer Vision Engineer skilled in Python, Image Processing, Deep Learning. Responsibilities include Use OpenCV and TensorFlow, Develop computer vision models, Optimize image processing algorithms."
UI Designer,4.0,Alfamart,Sawah Lunto,Palembang,1001 to 5000 employees,2009,Company - Cooperative,Retail,Retail,"Indomaret, Matahari Department Store",577.9,98735.9,"Hiring a UI Designer experienced with Prototyping, Figma, Adobe XD. Responsibilities: Ensure design consistency, Design user interfaces, Create prototypes."
Product Manager,3.6,Indofood,Bandung,Madiun,1001 to 5000 employees,2005,Company - Partnership,Food and Beverage,Consumer Goods,"Unilever Indonesia, Sampoerna, Djarum",666.7,7788.3,"Hiring a Product Manager experienced with Agile, Product Development, Scrum. You will be responsible for Communicate with stakeholders, Define product vision, Work with cross-functional teams."
Back-end Developer,2.9,Djarum,Surabaya,Payakumbuh,10001+ employees,1996,Company - Limited Partnership (LP),Tobacco,Consumer Goods,"Unilever Indonesia, Gudang Garam, Sampoerna",777.6,72931.4,"Hiring a Back-end Developer experienced with Node.js, SQL, Java. Responsibilities: Ensure application performance, Collaborate with front-end developers, Develop server-side logic."
Data Mining Engineer,4.5,Kalbe Farma,Cilegon,Bukittinggi,10001+ employees,1999,Company - Cooperative,Pharmaceuticals,Healthcare,,1159.8,6236.4,"Seeking a Data Mining Engineer proficient in Python, R, Data Mining. Responsibilities include Analyze large datasets, Optimize algorithms, Provide actionable insights."
Deep Learning Engineer,2.8,Garuda Indonesia,Cilegon,Bengkulu,10001+ employees,1999,Company - Partnership,Airlines,Transportation,"Blue Bird Group, Astra International",1276.6,68357.7,"Hiring a Deep Learning Engineer experienced with Neural Networks, Deep Learning, Keras. You will be responsible for Work with TensorFlow and Keras, Develop deep learning models, Deploy DL solutions."
Web Application Developer,3.7,Gudang Garam,Pariaman,Banjarbaru,5001 to 10000 employees,2004,Company - Holding,Tobacco,Consumer Goods,"Djarum, Unilever Indonesia, Indofood",50.6,6692.3,"We are looking for a Web Application Developer skilled in Web Development, JavaScript, APIs. Responsibilities include Develop web applications, Work with JavaScript and APIs, Ensure application security."
Data Engineer,2.9,Bank Mandiri,Gunungsitoli,Pekalongan,10001+ employees,2002,Company - Public,Banking,Finance,"Bank Negara Indonesia (BNI), Bank Central Asia (BCA), Bank Rakyat Indonesia (BRI)",698.8,36456.9,"Hiring a Data Engineer experienced with SQL, Big Data, Python. You will be responsible for Work with big data technologies, Build and maintain data pipelines, Collaborate with data scientists."
UX Designer,4.0,Indofood,Jayapura,Malang,10001+ employees,2013,Company - Private,Food and Beverage,Consumer Goods,"Djarum, Unilever Indonesia, Gudang Garam",662.2,8016.8,"We need a UX Designer with skills in Prototyping, Adobe XD, UX Research. Main tasks: Conduct user research, Design user experiences, Collaborate with developers."
Big Data Specialist,4.1,Sampoerna,Pariaman,Tegal,10001+ employees,1997,Company - Holding,Tobacco,Consumer Goods,"Gudang Garam, Unilever Indonesia, Indofood",1470.9,37340.8,"We are looking for a Big Data Specialist skilled in Python, Big Data, Spark. Responsibilities include Work with Hadoop and Spark, Collaborate with data engineers, Manage and analyze large datasets."
Product Manager,3.1,Unilever Indonesia,Depok,Surakarta,10001+ employees,1990,Company - Public,Consumer Goods,Consumer Goods,"Gudang Garam, Djarum, Indofood",341.9,81859.8,"Hiring a Product Manager experienced with Leadership, Agile, Product Management. You will be responsible for Work with cross-functional teams, Define product vision, Ensure product success."
Machine Learning Engineer,4.7,Blue Bird Group,Lubuklinggau,Semarang,10001+ employees,2010,Company - Limited Liability Company (LLC),Transportation,Transportation,"Astra International, Garuda Indonesia",412.1,14394.5,"Join our team as a Machine Learning Engineer. Skills required: Deep Learning, Python, Scikit-Learn. Responsibilities: Work with TensorFlow and PyTorch, Deploy ML solutions, Optimize ML algorithms."
IT Project Manager,4.3,XL Axiata,Tegal,Pangkal Pinang,5001 to 10000 employees,1997,Company - Limited Partnership (LP),Telecommunications,Telecommunications,"PT Telkom Indonesia, Indosat Ooredoo, Telekomunikasi Selular (Telkomsel)",1214.3,79055.1,"Join our team as an IT Project Manager. Skills required: Scrum, IT Project Management, Leadership. Responsibilities: Ensure project success, Manage project budgets, Manage IT projects."
Data Engineer,3.1,Bank Central Asia (BCA),Bau-Bau,Madiun,10001+ employees,2012,Company - Partnership,Banking,Finance,"Bank Negara Indonesia (BNI), Bank Rakyat Indonesia (BRI), Bank Mandiri",686.1,18006.3,"Hiring a Data Engineer experienced with Hadoop, ETL, Python. You will be responsible for Collaborate with data scientists, Work with big data technologies, Ensure data quality and integrity."
Product Manager,3.7,PT Telkom Indonesia,Parepare,Bekasi,10001+ employees,1992,Company - Private,Telecommunications,Telecommunications,"XL Axiata, Telekomunikasi Selular (Telkomsel), Indosat Ooredoo",752.1,51487.5,"Hiring a Product Manager experienced with Leadership, Scrum, Agile. You will be responsible for Define product vision, Communicate with stakeholders, Work with cross-functional teams."
JavaScript Developer,4.6,Gudang Garam,Gunungsitoli,Banjarmasin,1001 to 5000 employees,1996,Company - Sole Proprietorship,Tobacco,Consumer Goods,"Indofood, Djarum, Sampoerna",1216.1,10831.7,"Hiring a JavaScript Developer proficient in React, Angular, Vue.js. Responsibilities: Develop applications using JavaScript, Ensure code quality, Collaborate with other developers."
Machine Learning Engineer,4.3,PLN (Perusahaan Listrik Negara),Serang,Tarakan,10001+ employees,2004,Company - Sole Proprietorship,Energy,Energy,"Pertamina, Bumi Resources",317.3,47329.5,"Join our team as a Machine Learning Engineer. Skills required: Scikit-Learn, Python, Deep Learning. Responsibilities: Develop machine learning models, Optimize ML algorithms, Work with TensorFlow and PyTorch."
UX Designer,4.7,Bank Mandiri,Tual,Bekasi,1001 to 5000 employees,1993,Company - Non-profit,Banking,Finance,"Bank Rakyat Indonesia (BRI), Bank Negara Indonesia (BNI), Bank Central Asia (BCA)",1453.2,9402.3,"We need a UX Designer with skills in Prototyping, UX Research, Sketch. Main tasks: Ensure usability, Create wireframes and prototypes, Collaborate with developers."
Front-end Developer,3.4,Bank Central Asia (BCA),Depok,Bontang,1001 to 5000 employees,1997,Company - Holding,Banking,Finance,"Bank Rakyat Indonesia (BRI), Bank Mandiri, Bank Negara Indonesia (BNI)",425.5,75806.5,"Seeking a Front-end Developer with skills in HTML, React, JavaScript. Responsibilities: Work with HTML, CSS, and JavaScript, Develop user interfaces, Optimize front-end performance."
Reinforcement Learning Specialist,3.3,Bukalapak,Malang,Palangka Raya,10001+ employees,2001,Company - Non-profit,E-commerce,Technology,"Traveloka, Tokopedia, GoJek",225.0,14918.9,"Join our team as a Reinforcement Learning Specialist. Skills required: TensorFlow, Python, Reinforcement Learning. Responsibilities: Develop RL models, Work with TensorFlow and PyTorch, Conduct experiments."
