Job Title,Rating,Company Name,Location,Headquarters,Size,Founded,Type of ownership,Industry,Sector,Competitors,Average Salary,Average Revenue,Processed_JD
Product Manager,4.4,Unilever Indonesia,Sawah Lunto,Padang,5001 to 10000 employees,2005,Company - Joint Venture,Consumer Goods,Consumer Goods,"Sampoerna, Indofood, Gudang Garam",3279,48010,"Hiring a Product Manager experienced with Leadership, Agile, Product Development. You will be responsible for Communicate with stakeholders, Ensure product success, Manage product lifecycle."
Brand Designer,4.7,PT Telkom Indonesia,Tasikmalaya,Bandung,10001+ employees,2001,Company - Private,Telecommunications,Telecommunications,"Telekomunikasi Selular (Telkomsel), Indosat Ooredoo, XL Axiata",4110,66838,"Hiring a Brand Designer proficient in Visual Design, Graphic Design, Creativity. Responsibilities: Collaborate with marketing teams, Create visual identities, Ensure brand consistency."
Data Mining Engineer,2.7,Gudang Garam,Tasikmalaya,Medan,10001+ employees,1993,Company - Corporation (C Corp),Tobacco,Consumer Goods,"Unilever Indonesia, Djarum, Indofood",7680,90120,"Seeking a Data Mining Engineer proficient in Python, Data Mining, SQL. Responsibilities include Optimize algorithms, Provide actionable insights, Analyze large datasets."
Brand Designer,3.8,Bank Rakyat Indonesia (BRI),Cilegon,Yogyakarta,5001 to 10000 employees,2006,Company - Corporation (C Corp),Banking,Finance,"Bank Mandiri, Bank Central Asia (BCA), Bank Negara Indonesia (BNI)",5909,78435,"Hiring a Brand Designer proficient in Brand Strategy, Visual Design, Adobe Creative Suite. Responsibilities: Create visual identities, Work with design tools, Develop branding materials."
Research Scientist,3.4,Tokopedia,Binjai,Bandung,5001 to 10000 employees,2012,Company - Public,E-commerce,Technology,"Traveloka, GoJek, Bukalapak",1879,28275,"Join us as a Research Scientist. Required skills: Statistics, Data Analysis, Machine Learning. Duties: Develop new methodologies, Analyze experimental data, Conduct research and experiments."
Brand Designer,3.7,Lippo Group,Makassar,Medan,10001+ employees,2003,Company - Government,Conglomerate,Conglomerate,Sinar Mas Group,5234,96819,"Hiring a Brand Designer proficient in Brand Strategy, Creativity, Adobe Creative Suite. Responsibilities: Develop branding materials, Create visual identities, Ensure brand consistency."
Motion Graphics Designer,3.7,Traveloka,Tanjungbalai,Padang,10001+ employees,2013,Company - Partnership,E-commerce,Technology,"Tokopedia, GoJek, Bukalapak",5884,72987,"Join us as a Motion Graphics Designer. Required skills: Creativity, Animation, After Effects. Duties: Ensure animation quality, Work with animation tools, Create motion graphics."
NLP Engineer (Natural Language Processing),2.6,Bumi Resources,Singkawang,Jakarta,1001 to 5000 employees,2002,Company - Joint Venture,Mining,Energy,"PLN (Perusahaan Listrik Negara), Pertamina",6972,89105,"Join us as an NLP Engineer. Required skills: Python, NLTK, NLP. Duties: Use NLP libraries, Collaborate with linguists, Develop NLP models."
JavaScript Developer,3.6,Bukalapak,Sukabumi,Surabaya,5001 to 10000 employees,2012,Company - Cooperative,E-commerce,Technology,"Tokopedia, Traveloka, GoJek",4006,61130,"Hiring a JavaScript Developer proficient in JavaScript, React, Vue.js. Responsibilities: Ensure code quality, Develop applications using JavaScript, Collaborate with other developers."
AI Research Scientist,3.8,XL Axiata,Bogor,Medan,5001 to 10000 employees,2012,Company - Professional Corporation (PC),Telecommunications,Telecommunications,"PT Telkom Indonesia, Indosat Ooredoo, Telekomunikasi Selular (Telkomsel)",5020,67020,"We need an AI Research Scientist with skills in AI, Research, Python. Main tasks: Conduct AI research, Publish research papers, Develop new AI algorithms."
NLP Engineer (Natural Language Processing),3.3,Sampoerna,Jambi,Jakarta,10001+ employees,2007,Company - Government,Tobacco,Consumer Goods,"Indofood, Gudang Garam, Djarum",3858,59449,"Join us as an NLP Engineer. Required skills: NLTK, SpaCy, NLP. Duties: Develop NLP models, Work with text data, Collaborate with linguists."
Front-end Developer,4.3,Unilever Indonesia,Batam,Padang,5001 to 10000 employees,2005,Company - Joint Venture,Consumer Goods,Consumer Goods,"Sampoerna, Gudang Garam, Djarum",3111,48010,"Seeking a Front-end Developer with skills in CSS, JavaScript, HTML. Responsibilities: Optimize front-end performance, Work with HTML, CSS, and JavaScript, Collaborate with back-end developers."
Data Mining Engineer,4.8,Gudang Garam,Jakarta,Medan,10001+ employees,1993,Company - Corporation (C Corp),Tobacco,Consumer Goods,"Djarum, Unilever Indonesia, Sampoerna",7958,90120,"Seeking a Data Mining Engineer proficient in Algorithms, Data Mining, SQL. Responsibilities include Provide actionable insights, Work with data scientists, Develop data mining models."
NLP Engineer (Natural Language Processing),3.5,Matahari Department Store,Prabumulih,Bandung,10001+ employees,2001,Company - Sole Proprietorship,Retail,Retail,"Alfamart, Indomaret",4889,74246,"Join us as an NLP Engineer. Required skills: NLTK, SpaCy, Text Mining. Duties: Collaborate with linguists, Deploy NLP solutions, Use NLP libraries."
IT Project Manager,2.8,Bank Mandiri,Probolinggo,Padang,1001 to 5000 employees,1996,Company - Subsidiary,Banking,Finance,"Bank Negara Indonesia (BNI), Bank Rakyat Indonesia (BRI), Bank Central Asia (BCA)",643,8279,"Join our team as an IT Project Manager. Skills required: Scrum, Technical Background, Leadership. Responsibilities: Manage IT projects, Manage project budgets, Communicate with stakeholders."
Big Data Specialist,2.6,Kalbe Farma,Batu,Bandung,1001 to 5000 employees,1991,Company - Professional Corporation (PC),Pharmaceuticals,Healthcare,,339,5383,"We are looking for a Big Data Specialist skilled in Python, Hadoop, NoSQL. Responsibilities include Manage and analyze large datasets, Work with Hadoop and Spark, Ensure data scalability."
Computer Vision Engineer,4.3,Djarum,Semarang,Medan,5001 to 10000 employees,1991,Company - S Corporation (S Corp),Tobacco,Consumer Goods,"Gudang Garam, Sampoerna, Unilever Indonesia",5575,73942,"We are looking for a Computer Vision Engineer skilled in Image Processing, Python, OpenCV. Responsibilities include Develop computer vision models, Collaborate with data scientists, Optimize image processing algorithms."
Back-end Developer,3.8,XL Axiata,Ambon,Medan,5001 to 10000 employees,2012,Company - Professional Corporation (PC),Telecommunications,Telecommunications,"Indosat Ooredoo, Telekomunikasi Selular (Telkomsel), PT Telkom Indonesia",3987,67020,"Hiring a Back-end Developer experienced with Node.js, APIs, Java. Responsibilities: Ensure application performance, Optimize server-side code, Work with databases."
NLP Engineer (Natural Language Processing),4.2,Sinar Mas Group,Kendari,Surabaya,5001 to 10000 employees,2005,Company - S Corporation (S Corp),Conglomerate,Conglomerate,Lippo Group,5007,87535,"Join us as an NLP Engineer. Required skills: Python, Text Mining, SpaCy. Duties: Use NLP libraries, Collaborate with linguists, Develop NLP models."
Data Scientist,3.6,Telekomunikasi Selular (Telkomsel),Probolinggo,Bandung,5001 to 10000 employees,2006,Company - Government,Telecommunications,Telecommunications,"XL Axiata, Indosat Ooredoo, PT Telkom Indonesia",3373,38849,"We are looking for a Data Scientist to join our team. Requirements: Experience in Python, Machine Learning, SQL. Responsibilities: Collaborate with cross-functional teams, Work with large datasets, Develop predictive models."
Product Manager,2.9,Bank Mandiri,Blitar,Padang,1001 to 5000 employees,1996,Company - Subsidiary,Banking,Finance,"Bank Central Asia (BCA), Bank Negara Indonesia (BNI), Bank Rakyat Indonesia (BRI)",712,8279,"Hiring a Product Manager experienced with Product Development, Product Management, Agile. You will be responsible for Define product vision, Communicate with stakeholders, Manage product lifecycle."
Product Manager,4.2,Pertamina,Manado,Bandung,5001 to 10000 employees,1990,Company - S Corporation (S Corp),Oil and Gas,Energy,"Bumi Resources, PLN (Perusahaan Listrik Negara)",194,2646,"Hiring a Product Manager experienced with Product Development, Leadership, Agile. You will be responsible for Communicate with stakeholders, Manage product lifecycle, Define product vision."
Data Scientist,5.0,Indofood,Tomohon,Medan,1001 to 5000 employees,2013,Company - Non-profit,Food and Beverage,Consumer Goods,"Unilever Indonesia, Gudang Garam, Djarum",3317,58848,"We are looking for a Data Scientist to join our team. Requirements: Experience in SQL, Machine Learning, R. Responsibilities: Work with large datasets, Communicate findings to stakeholders, Collaborate with cross-functional teams."
Agile Project Manager,4.8,Blue Bird Group,Tegal,Bandung,1001 to 5000 employees,1996,Company - Government,Transportation,Transportation,"Astra International, Garuda Indonesia",4651,71491,"We need an Agile Project Manager with skills in Project Management, Communication, Agile. Main tasks: Facilitate agile processes, Ensure project delivery, Manage agile projects."
Graphic Designer,3.3,Bank Negara Indonesia (BNI),Batu,Bandung,10001+ employees,2007,Company - Partnership,Banking,Finance,"Bank Mandiri, Bank Rakyat Indonesia (BRI), Bank Central Asia (BCA)",6708,96697,"Seeking a Graphic Designer proficient in InDesign, Graphic Design, Creativity. Responsibilities: Work with design tools, Ensure design quality, Develop branding materials."
AI Research Scientist,4.9,Bank Central Asia (BCA),Tangerang Selatan,Padang,1001 to 5000 employees,1993,Company - Limited Liability Company (LLC),Banking,Finance,"Bank Mandiri, Bank Rakyat Indonesia (BRI), Bank Negara Indonesia (BNI)",1170,14255,"We need an AI Research Scientist with skills in Machine Learning, AI, Research. Main tasks: Develop new AI algorithms, Analyze experimental results, Publish research papers."
Business Intelligence Analyst,3.1,Bank Mandiri,Bandung,Padang,1001 to 5000 employees,1996,Company - Subsidiary,Banking,Finance,"Bank Negara Indonesia (BNI), Bank Central Asia (BCA), Bank Rakyat Indonesia (BRI)",692,8279,"We need a Business Intelligence Analyst with skills in Analytics, SQL, BI Tools. Main tasks: Work with business stakeholders, Analyze data trends, Develop BI solutions."
Full-stack Developer,4.1,Bank Mandiri,Jayapura,Padang,1001 to 5000 employees,1996,Company - Subsidiary,Banking,Finance,"Bank Central Asia (BCA), Bank Rakyat Indonesia (BRI), Bank Negara Indonesia (BNI)",676,8279,"We need a Full-stack Developer with skills in JavaScript, Node.js, HTML. Main tasks: Develop both front-end and back-end, Optimize full-stack applications, Ensure full-stack performance."
Web Application Developer,3.5,XL Axiata,Banjarmasin,Medan,5001 to 10000 employees,2012,Company - Professional Corporation (PC),Telecommunications,Telecommunications,"Telekomunikasi Selular (Telkomsel), PT Telkom Indonesia, Indosat Ooredoo",4496,67020,"We are looking for a Web Application Developer skilled in CSS, APIs, Web Development. Responsibilities include Collaborate with designers, Work with JavaScript and APIs, Optimize web application performance."
UI Designer,4.5,Sampoerna,Ambon,Jakarta,10001+ employees,2007,Company - Government,Tobacco,Consumer Goods,"Unilever Indonesia, Indofood, Djarum",5327,59449,"Hiring a UI Designer experienced with Sketch, Figma, Adobe XD. Responsibilities: Create prototypes, Ensure design consistency, Design user interfaces."
Data Analyst,4.0,Bank Mandiri,Jambi,Padang,1001 to 5000 employees,1996,Company - Subsidiary,Banking,Finance,"Bank Negara Indonesia (BNI), Bank Rakyat Indonesia (BRI), Bank Central Asia (BCA)",652,8279,"Seeking a Data Analyst proficient in Excel, SQL, Data Visualization. Responsibilities include Create reports and dashboards, Support data-driven decision making, Identify trends and patterns."
Robotics Engineer,4.2,Djarum,Tegal,Medan,5001 to 10000 employees,1991,Company - S Corporation (S Corp),Tobacco,Consumer Goods,"Unilever Indonesia, Indofood, Gudang Garam",3815,73942,"Seeking a Robotics Engineer proficient in ROS, Robotics, Python. Responsibilities include Develop robotics solutions, Test and optimize robotics algorithms, Program robots."
Research Scientist,2.8,Astra International,Ternate,Jakarta,5001 to 10000 employees,1999,Company - Public,Automotive,Transportation,"Garuda Indonesia, Blue Bird Group",2795,36409,"Join us as a Research Scientist. Required skills: Data Analysis, R, Statistics. Duties: Analyze experimental data, Publish research findings, Develop new methodologies."
Scrum Master,2.6,Indosat Ooredoo,Cimahi,Medan,1001 to 5000 employees,2009,Company - Corporation (C Corp),Telecommunications,Telecommunications,"Telekomunikasi Selular (Telkomsel), XL Axiata, PT Telkom Indonesia",1373,16941,"We are looking for a Scrum Master skilled in Project Management, Agile, Scrum. Responsibilities include Facilitate scrum processes, Communicate with stakeholders, Remove obstacles."
Data Mining Engineer,3.5,Traveloka,Madiun,Padang,10001+ employees,2013,Company - Partnership,E-commerce,Technology,"Tokopedia, Bukalapak, GoJek",5714,72987,"Seeking a Data Mining Engineer proficient in SQL, R, Data Mining. Responsibilities include Develop data mining models, Analyze large datasets, Provide actionable insights."
Reinforcement Learning Specialist,3.6,Bank Rakyat Indonesia (BRI),Madiun,Yogyakarta,5001 to 10000 employees,2006,Company - Corporation (C Corp),Banking,Finance,"Bank Negara Indonesia (BNI), Bank Mandiri, Bank Central Asia (BCA)",5145,78435,"Join our team as a Reinforcement Learning Specialist. Skills required: Python, TensorFlow, Algorithms. Responsibilities: Work with TensorFlow and PyTorch, Conduct experiments, Optimize RL algorithms."
Program Manager,4.0,PT Telkom Indonesia,Banjarmasin,Bandung,10001+ employees,2001,Company - Private,Telecommunications,Telecommunications,"XL Axiata, Indosat Ooredoo, Telekomunikasi Selular (Telkomsel)",4117,66838,"Join us as a Program Manager. Required skills: Scrum, Agile, Leadership. Duties: Manage programs, Manage program budgets, Ensure program delivery."
Deep Learning Engineer,3.4,Gudang Garam,Yogyakarta,Medan,10001+ employees,1993,Company - Corporation (C Corp),Tobacco,Consumer Goods,"Sampoerna, Djarum, Unilever Indonesia",4786,90120,"Hiring a Deep Learning Engineer experienced with TensorFlow, Deep Learning, Keras. You will be responsible for Collaborate with data scientists, Deploy DL solutions, Work with TensorFlow and Keras."
Back-end Developer,2.7,Sampoerna,Mojokerto,Jakarta,10001+ employees,2007,Company - Government,Tobacco,Consumer Goods,"Indofood, Unilever Indonesia, Gudang Garam",4453,59449,"Hiring a Back-end Developer experienced with Java, APIs, Python. Responsibilities: Work with databases, Ensure application performance, Optimize server-side code."
Big Data Specialist,2.7,Pertamina,Sawah Lunto,Bandung,5001 to 10000 employees,1990,Company - S Corporation (S Corp),Oil and Gas,Energy,"PLN (Perusahaan Listrik Negara), Bumi Resources",225,2646,"We are looking for a Big Data Specialist skilled in Hadoop, NoSQL, Python. Responsibilities include Ensure data scalability, Manage and analyze large datasets, Develop big data solutions."
Scrum Master,4.6,Indomaret,Jayapura,Surabaya,10001+ employees,1994,Company - Sole Proprietorship,Retail,Retail,"Alfamart, Matahari Department Store",2386,30683,"We are looking for a Scrum Master skilled in Scrum, Team Collaboration, Agile. Responsibilities include Facilitate scrum processes, Ensure team productivity, Remove obstacles."
UI/UX Developer,5.0,XL Axiata,Remote,Medan,5001 to 10000 employees,2012,Company - Professional Corporation (PC),Telecommunications,Telecommunications,"PT Telkom Indonesia, Telekomunikasi Selular (Telkomsel), Indosat Ooredoo",5224,67020,"Join us as a UI/UX Developer. Required skills: Prototyping, UX Research, Adobe XD. Duties: Collaborate with developers, Work with design tools, Conduct user research."
UX Designer,2.7,Alfamart,Binjai,Jakarta,5001 to 10000 employees,2011,Company - Limited Liability Partnership (LLP),Retail,Retail,"Indomaret, Matahari Department Store",4954,61247,"We need a UX Designer with skills in Prototyping, UX Research, Wireframing. Main tasks: Design user experiences, Create wireframes and prototypes, Collaborate with developers."
JavaScript Developer,2.8,Bukalapak,Bau-Bau,Surabaya,5001 to 10000 employees,2012,Company - Cooperative,E-commerce,Technology,"Traveloka, Tokopedia, GoJek",3930,61130,"Hiring a JavaScript Developer proficient in Vue.js, Node.js, Angular. Responsibilities: Ensure code quality, Optimize JavaScript performance, Collaborate with other developers."
Web Application Developer,3.6,Lippo Group,Cimahi,Medan,10001+ employees,2003,Company - Government,Conglomerate,Conglomerate,Sinar Mas Group,8508,96819,"We are looking for a Web Application Developer skilled in CSS, Web Development, HTML. Responsibilities include Develop web applications, Work with JavaScript and APIs, Optimize web application performance."
Interaction Designer,4.2,Gudang Garam,Malang,Medan,10001+ employees,1993,Company - Corporation (C Corp),Tobacco,Consumer Goods,"Sampoerna, Unilever Indonesia, Indofood",5459,90120,"We are looking for an Interaction Designer skilled in Adobe XD, Interaction Design, UI Design. Responsibilities include Collaborate with developers, Work with design tools, Ensure interaction quality."
Back-end Developer,4.8,XL Axiata,Dumai,Medan,5001 to 10000 employees,2012,Company - Professional Corporation (PC),Telecommunications,Telecommunications,"Indosat Ooredoo, Telekomunikasi Selular (Telkomsel), PT Telkom Indonesia",5796,67020,"Hiring a Back-end Developer experienced with Node.js, Java, SQL. Responsibilities: Work with databases, Optimize server-side code, Collaborate with front-end developers."
UI Designer,2.6,Djarum,Bau-Bau,Medan,5001 to 10000 employees,1991,Company - S Corporation (S Corp),Tobacco,Consumer Goods,"Unilever Indonesia, Indofood, Gudang Garam",5768,73942,"Hiring a UI Designer experienced with Adobe XD, Figma, Sketch. Responsibilities: Collaborate with developers, Ensure design consistency, Work with design tools."
Business Intelligence Analyst,4.2,Djarum,Bau-Bau,Medan,5001 to 10000 employees,1991,Company - S Corporation (S Corp),Tobacco,Consumer Goods,"Gudang Garam, Unilever Indonesia, Sampoerna",4625,73942,"We need a Business Intelligence Analyst with skills in Data Modeling, Analytics, Dashboarding. Main tasks: Develop BI solutions, Provide actionable insights, Analyze data trends."
Machine Learning Engineer,4.9,Blue Bird Group,Banjarbaru,Bandung,1001 to 5000 employees,1996,Company - Government,Transportation,Transportation,"Garuda Indonesia, Astra International",5052,71491,"Join our team as a Machine Learning Engineer. Skills required: TensorFlow, Deep Learning, Scikit-Learn. Responsibilities: Work with TensorFlow and PyTorch, Deploy ML solutions, Optimize ML algorithms."
Graphic Designer,2.8,Indosat Ooredoo,Lubuklinggau,Medan,1001 to 5000 employees,2009,Company - Corporation (C Corp),Telecommunications,Telecommunications,"PT Telkom Indonesia, Telekomunikasi Selular (Telkomsel), XL Axiata",875,16941,"Seeking a Graphic Designer proficient in Illustrator, Creativity, Adobe Photoshop. Responsibilities: Create visual designs, Work with design tools, Ensure design quality."
UX Designer,2.8,Bank Negara Indonesia (BNI),Sorong,Bandung,10001+ employees,2007,Company - Partnership,Banking,Finance,"Bank Mandiri, Bank Rakyat Indonesia (BRI), Bank Central Asia (BCA)",5032,96697,"We need a UX Designer with skills in Adobe XD, UX Research, Wireframing. Main tasks: Design user experiences, Create wireframes and prototypes, Collaborate with developers."
Web Developer,4.6,Indofood,Cilegon,Medan,1001 to 5000 employees,2013,Company - Non-profit,Food and Beverage,Consumer Goods,"Unilever Indonesia, Sampoerna, Gudang Garam",3954,58848,"We need a Web Developer proficient in CSS, Node.js, JavaScript. Responsibilities: Collaborate with designers, Optimize web applications, Ensure website performance."
Computer Vision Engineer,4.8,Indosat Ooredoo,Tidore Kepulauan,Medan,1001 to 5000 employees,2009,Company - Corporation (C Corp),Telecommunications,Telecommunications,"XL Axiata, Telekomunikasi Selular (Telkomsel), PT Telkom Indonesia",1373,16941,"We are looking for a Computer Vision Engineer skilled in Computer Vision, Image Processing, Deep Learning. Responsibilities include Work with image data, Collaborate with data scientists, Optimize image processing algorithms."
Computer Vision Engineer,4.6,GoJek,Palembang,Padang,1001 to 5000 employees,2008,Company - Private,E-commerce,Technology,"Bukalapak, Traveloka, Tokopedia",5500,61845,"We are looking for a Computer Vision Engineer skilled in Computer Vision, Python, Image Processing. Responsibilities include Use OpenCV and TensorFlow, Optimize image processing algorithms, Work with image data."
Product Manager,4.9,Bank Rakyat Indonesia (BRI),Sukabumi,Yogyakarta,5001 to 10000 employees,2006,Company - Corporation (C Corp),Banking,Finance,"Bank Negara Indonesia (BNI), Bank Mandiri, Bank Central Asia (BCA)",4023,78435,"Hiring a Product Manager experienced with Scrum, Agile, Product Development. You will be responsible for Define product vision, Communicate with stakeholders, Ensure product success."
IT Project Manager,2.7,Bumi Resources,Bitung,Jakarta,1001 to 5000 employees,2002,Company - Joint Venture,Mining,Energy,"Pertamina, PLN (Perusahaan Listrik Negara)",5189,89105,"Join our team as an IT Project Manager. Skills required: Technical Background, Leadership, Agile. Responsibilities: Ensure project success, Work with IT teams, Manage project budgets."
Graphic Designer,4.8,GoJek,Kendari,Padang,1001 to 5000 employees,2008,Company - Private,E-commerce,Technology,"Bukalapak, Tokopedia, Traveloka",3501,61845,"Seeking a Graphic Designer proficient in Adobe Photoshop, Creativity, Illustrator. Responsibilities: Develop branding materials, Ensure design quality, Collaborate with marketing teams."
UI Designer,3.3,Alfamart,Kupang,Jakarta,5001 to 10000 employees,2011,Company - Limited Liability Partnership (LLP),Retail,Retail,"Matahari Department Store, Indomaret",4597,61247,"Hiring a UI Designer experienced with Sketch, Prototyping, Adobe XD. Responsibilities: Create prototypes, Work with design tools, Ensure design consistency."
NLP Engineer (Natural Language Processing),4.5,Matahari Department Store,Makassar,Bandung,10001+ employees,2001,Company - Sole Proprietorship,Retail,Retail,"Indomaret, Alfamart",4455,74246,"Join us as an NLP Engineer. Required skills: NLP, SpaCy, NLTK. Duties: Develop NLP models, Use NLP libraries, Work with text data."
Data Mining Engineer,2.6,Bank Central Asia (BCA),Ternate,Padang,1001 to 5000 employees,1993,Company - Limited Liability Company (LLC),Banking,Finance,"Bank Rakyat Indonesia (BRI), Bank Negara Indonesia (BNI), Bank Mandiri",861,14255,"Seeking a Data Mining Engineer proficient in Algorithms, R, SQL. Responsibilities include Analyze large datasets, Optimize algorithms, Provide actionable insights."
JavaScript Developer,3.7,Bank Mandiri,Bandung,Padang,1001 to 5000 employees,1996,Company - Subsidiary,Banking,Finance,"Bank Rakyat Indonesia (BRI), Bank Central Asia (BCA), Bank Negara Indonesia (BNI)",740,8279,"Hiring a JavaScript Developer proficient in Angular, React, Node.js. Responsibilities: Optimize JavaScript performance, Ensure code quality, Work with frameworks like React and Node.js."
Computer Vision Engineer,4.1,Alfamart,Surakarta,Jakarta,5001 to 10000 employees,2011,Company - Limited Liability Partnership (LLP),Retail,Retail,"Matahari Department Store, Indomaret",3461,61247,"We are looking for a Computer Vision Engineer skilled in Image Processing, Deep Learning, OpenCV. Responsibilities include Use OpenCV and TensorFlow, Work with image data, Develop computer vision models."
IT Project Manager,4.6,PT Telkom Indonesia,Mojokerto,Bandung,10001+ employees,2001,Company - Private,Telecommunications,Telecommunications,"Indosat Ooredoo, Telekomunikasi Selular (Telkomsel), XL Axiata",3932,66838,"Join our team as an IT Project Manager. Skills required: IT Project Management, Leadership, Agile. Responsibilities: Ensure project success, Work with IT teams, Communicate with stakeholders."
UI Designer,3.6,Ciputra Development,Tual,Padang,5001 to 10000 employees,2011,Company - Professional Corporation (PC),Real Estate,Real Estate,,1918,28058,"Hiring a UI Designer experienced with Sketch, UI Design, Prototyping. Responsibilities: Work with design tools, Collaborate with developers, Design user interfaces."
UX Designer,2.6,Unilever Indonesia,Malang,Padang,5001 to 10000 employees,2005,Company - Joint Venture,Consumer Goods,Consumer Goods,"Djarum, Sampoerna, Gudang Garam",4017,48010,"We need a UX Designer with skills in Sketch, Prototyping, UX Research. Main tasks: Create wireframes and prototypes, Collaborate with developers, Conduct user research."
UX Designer,2.9,Bank Rakyat Indonesia (BRI),Tual,Yogyakarta,5001 to 10000 employees,2006,Company - Corporation (C Corp),Banking,Finance,"Bank Mandiri, Bank Negara Indonesia (BNI), Bank Central Asia (BCA)",5657,78435,"We need a UX Designer with skills in Prototyping, Adobe XD, Wireframing. Main tasks: Create wireframes and prototypes, Conduct user research, Design user experiences."
Data Analyst,4.1,Astra International,Bau-Bau,Jakarta,5001 to 10000 employees,1999,Company - Public,Automotive,Transportation,"Garuda Indonesia, Blue Bird Group",1986,36409,"Seeking a Data Analyst proficient in Excel, SQL, Tableau. Responsibilities include Create reports and dashboards, Analyze business data, Identify trends and patterns."
