Job Title,Rating,Company Name,Location,Headquarters,Size,Founded,Type of ownership,Industry,Sector,Competitors,Average Salary,Average Revenue,Processed_JD
Reinforcement Learning Specialist,3.3,Ciputra Development,Bogor,Padang,5001 to 10000 employees,2011,Company - Professional Corporation (PC),Real Estate,Real Estate,,1757,28058,"Join our team as a Reinforcement Learning Specialist. Skills required: Algorithms, Machine Learning, Python. Responsibilities: Optimize RL algorithms, Work with TensorFlow and PyTorch, Collaborate with data scientists."
Data Mining Engineer,3.0,Gudang Garam,Mataram,Medan,10001+ employees,1993,Company - Corporation (C Corp),Tobacco,Consumer Goods,"Indofood, Djarum, Unilever Indonesia",6848,90120,"Seeking a Data Mining Engineer proficient in SQL, Data Mining, Algorithms. Responsibilities include Develop data mining models, Optimize algorithms, Work with data scientists."
Program Manager,2.9,Unilever Indonesia,Tangerang,Padang,5001 to 10000 employees,2005,Company - Joint Venture,Consumer Goods,Consumer Goods,"Indofood, Gudang Garam, Sampoerna",3576,48010,"Join us as a Program Manager. Required skills: Communication, Program Management, Agile. Duties: Manage programs, Ensure program delivery, Manage program budgets."
Robotics Engineer,2.7,Bank Mandiri,Gorontalo,Padang,1001 to 5000 employees,1996,Company - Subsidiary,Banking,Finance,"Bank Rakyat Indonesia (BRI), Bank Central Asia (BCA), Bank Negara Indonesia (BNI)",679,8279,"Seeking a Robotics Engineer proficient in Python, Control Systems, C++. Responsibilities include Program robots, Work with control systems, Develop robotics solutions."
NLP Engineer (Natural Language Processing),4.6,Sampoerna,Kendari,Jakarta,10001+ employees,2007,Company - Government,Tobacco,Consumer Goods,"Djarum, Unilever Indonesia, Gudang Garam",3767,59449,"Join us as an NLP Engineer. Required skills: NLTK, Text Mining, NLP. Duties: Deploy NLP solutions, Collaborate with linguists, Work with text data."
Back-end Developer,4.3,Matahari Department Store,Tidore Kepulauan,Bandung,10001+ employees,2001,Company - Sole Proprietorship,Retail,Retail,"Alfamart, Indomaret",4706,74246,"Hiring a Back-end Developer experienced with APIs, Python, SQL. Responsibilities: Collaborate with front-end developers, Optimize server-side code, Work with databases."
JavaScript Developer,3.6,Sinar Mas Group,Banjarmasin,Surabaya,5001 to 10000 employees,2005,Company - S Corporation (S Corp),Conglomerate,Conglomerate,Lippo Group,4824,87535,"Hiring a JavaScript Developer proficient in Vue.js, Angular, React. Responsibilities: Collaborate with other developers, Optimize JavaScript performance, Work with frameworks like React and Node.js."
Computer Vision Engineer,2.8,Djarum,Mataram,Medan,5001 to 10000 employees,1991,Company - S Corporation (S Corp),Tobacco,Consumer Goods,"Indofood, Gudang Garam, Unilever Indonesia",5081,73942,"We are looking for a Computer Vision Engineer skilled in OpenCV, Python, Image Processing. Responsibilities include Use OpenCV and TensorFlow, Collaborate with data scientists, Work with image data."
JavaScript Developer,4.2,Blue Bird Group,Surabaya,Bandung,1001 to 5000 employees,1996,Company - Government,Transportation,Transportation,"Garuda Indonesia, Astra International",5530,71491,"Hiring a JavaScript Developer proficient in Vue.js, JavaScript, React. Responsibilities: Optimize JavaScript performance, Work with frameworks like React and Node.js, Ensure code quality."
NLP Engineer (Natural Language Processing),3.0,Bukalapak,Bekasi,Surabaya,5001 to 10000 employees,2012,Company - Cooperative,E-commerce,Technology,"Tokopedia, Traveloka, GoJek",4202,61130,"Join us as an NLP Engineer. Required skills: NLTK, Python, SpaCy. Duties: Use NLP libraries, Work with text data, Develop NLP models."
Back-end Developer,3.4,Ciputra Development,Sungai Penuh,Padang,5001 to 10000 employees,2011,Company - Professional Corporation (PC),Real Estate,Real Estate,,2488,28058,"Hiring a Back-end Developer experienced with SQL, APIs, Java. Responsibilities: Work with databases, Ensure application performance, Optimize server-side code."
NLP Engineer (Natural Language Processing),3.9,Astra International,Lhokseumawe,Jakarta,5001 to 10000 employees,1999,Company - Public,Automotive,Transportation,"Blue Bird Group, Garuda Indonesia",2360,36409,"Join us as an NLP Engineer. Required skills: NLP, NLTK, SpaCy. Duties: Deploy NLP solutions, Collaborate with linguists, Develop NLP models."
UI Designer,2.8,Indosat Ooredoo,Subulussalam,Medan,1001 to 5000 employees,2009,Company - Corporation (C Corp),Telecommunications,Telecommunications,"Telekomunikasi Selular (Telkomsel), PT Telkom Indonesia, XL Axiata",1277,16941,"Hiring a UI Designer experienced with Sketch, UI Design, Adobe XD. Responsibilities: Create prototypes, Work with design tools, Design user interfaces."
Big Data Specialist,3.2,Alfamart,Bandung,Jakarta,5001 to 10000 employees,2011,Company - Limited Liability Partnership (LLP),Retail,Retail,"Matahari Department Store, Indomaret",3393,61247,"We are looking for a Big Data Specialist skilled in NoSQL, Big Data, Hadoop. Responsibilities include Develop big data solutions, Collaborate with data engineers, Work with Hadoop and Spark."
Graphic Designer,2.5,Indomaret,Banjarbaru,Surabaya,10001+ employees,1994,Company - Sole Proprietorship,Retail,Retail,"Alfamart, Matahari Department Store",1935,30683,"Seeking a Graphic Designer proficient in Illustrator, Creativity, Adobe Photoshop. Responsibilities: Ensure design quality, Create visual designs, Develop branding materials."
UI/UX Developer,4.9,Pertamina,Palopo,Bandung,5001 to 10000 employees,1990,Company - S Corporation (S Corp),Oil and Gas,Energy,"PLN (Perusahaan Listrik Negara), Bumi Resources",200,2646,"Join us as a UI/UX Developer. Required skills: UX Research, Sketch, Prototyping. Duties: Conduct user research, Collaborate with developers, Create prototypes."
Web Application Developer,2.8,Bank Rakyat Indonesia (BRI),Yogyakarta,Yogyakarta,5001 to 10000 employees,2006,Company - Corporation (C Corp),Banking,Finance,"Bank Mandiri, Bank Central Asia (BCA), Bank Negara Indonesia (BNI)",6883,78435,"We are looking for a Web Application Developer skilled in APIs, JavaScript, CSS. Responsibilities include Develop web applications, Optimize web application performance, Collaborate with designers."
NLP Engineer (Natural Language Processing),3.1,Bank Negara Indonesia (BNI),Probolinggo,Bandung,10001+ employees,2007,Company - Partnership,Banking,Finance,"Bank Central Asia (BCA), Bank Rakyat Indonesia (BRI), Bank Mandiri",5584,96697,"Join us as an NLP Engineer. Required skills: SpaCy, Text Mining, Python. Duties: Use NLP libraries, Collaborate with linguists, Work with text data."
Data Analyst,3.6,Garuda Indonesia,Mataram,Jakarta,1001 to 5000 employees,1995,Company - Private,Airlines,Transportation,"Blue Bird Group, Astra International",545,8567,"Seeking a Data Analyst proficient in Data Visualization, Tableau, SQL. Responsibilities include Work with SQL and Excel, Identify trends and patterns, Support data-driven decision making."
Scrum Master,3.1,PT Telkom Indonesia,Tegal,Bandung,10001+ employees,2001,Company - Private,Telecommunications,Telecommunications,"Telekomunikasi Selular (Telkomsel), Indosat Ooredoo, XL Axiata",3546,66838,"We are looking for a Scrum Master skilled in Facilitation, Scrum, Agile. Responsibilities include Facilitate scrum processes, Remove obstacles, Ensure team productivity."
Web Application Developer,3.5,Bank Mandiri,Tual,Padang,1001 to 5000 employees,1996,Company - Subsidiary,Banking,Finance,"Bank Central Asia (BCA), Bank Negara Indonesia (BNI), Bank Rakyat Indonesia (BRI)",646,8279,"We are looking for a Web Application Developer skilled in APIs, HTML, CSS. Responsibilities include Ensure application security, Work with JavaScript and APIs, Optimize web application performance."
Agile Project Manager,4.2,Sampoerna,Payakumbuh,Jakarta,10001+ employees,2007,Company - Government,Tobacco,Consumer Goods,"Unilever Indonesia, Indofood, Gudang Garam",5028,59449,"We need an Agile Project Manager with skills in Project Management, Scrum, Communication. Main tasks: Collaborate with agile teams, Ensure project delivery, Facilitate agile processes."
Reinforcement Learning Specialist,5.0,Alfamart,Bukittinggi,Jakarta,5001 to 10000 employees,2011,Company - Limited Liability Partnership (LLP),Retail,Retail,"Matahari Department Store, Indomaret",4463,61247,"Join our team as a Reinforcement Learning Specialist. Skills required: Machine Learning, Reinforcement Learning, Python. Responsibilities: Conduct experiments, Work with TensorFlow and PyTorch, Collaborate with data scientists."
Web Application Developer,3.8,Indosat Ooredoo,Tidore Kepulauan,Medan,1001 to 5000 employees,2009,Company - Corporation (C Corp),Telecommunications,Telecommunications,"XL Axiata, Telekomunikasi Selular (Telkomsel), PT Telkom Indonesia",1196,16941,"We are looking for a Web Application Developer skilled in HTML, JavaScript, APIs. Responsibilities include Work with JavaScript and APIs, Optimize web application performance, Ensure application security."
Front-end Developer,2.6,Bukalapak,Blitar,Surabaya,5001 to 10000 employees,2012,Company - Cooperative,E-commerce,Technology,"GoJek, Tokopedia, Traveloka",5337,61130,"Seeking a Front-end Developer with skills in JavaScript, React, HTML. Responsibilities: Develop user interfaces, Collaborate with back-end developers, Work with HTML, CSS, and JavaScript."
Reinforcement Learning Specialist,3.6,Ciputra Development,Pematang Siantar,Padang,5001 to 10000 employees,2011,Company - Professional Corporation (PC),Real Estate,Real Estate,,1587,28058,"Join our team as a Reinforcement Learning Specialist. Skills required: Algorithms, Reinforcement Learning, Machine Learning. Responsibilities: Collaborate with data scientists, Conduct experiments, Develop RL models."
JavaScript Developer,4.0,Bank Rakyat Indonesia (BRI),Bandar Lampung,Yogyakarta,5001 to 10000 employees,2006,Company - Corporation (C Corp),Banking,Finance,"Bank Negara Indonesia (BNI), Bank Central Asia (BCA), Bank Mandiri",6389,78435,"Hiring a JavaScript Developer proficient in Vue.js, JavaScript, Node.js. Responsibilities: Optimize JavaScript performance, Work with frameworks like React and Node.js, Ensure code quality."
Brand Designer,5.0,Indosat Ooredoo,Magelang,Medan,1001 to 5000 employees,2009,Company - Corporation (C Corp),Telecommunications,Telecommunications,"Telekomunikasi Selular (Telkomsel), PT Telkom Indonesia, XL Axiata",1391,16941,"Hiring a Brand Designer proficient in Graphic Design, Adobe Creative Suite, Creativity. Responsibilities: Work with design tools, Ensure brand consistency, Create visual identities."
Web Application Developer,3.6,Bukalapak,Serang,Surabaya,5001 to 10000 employees,2012,Company - Cooperative,E-commerce,Technology,"GoJek, Tokopedia, Traveloka",3099,61130,"We are looking for a Web Application Developer skilled in CSS, Web Development, HTML. Responsibilities include Optimize web application performance, Collaborate with designers, Work with JavaScript and APIs."
Scrum Master,2.9,Lippo Group,Parepare,Medan,10001+ employees,2003,Company - Government,Conglomerate,Conglomerate,Sinar Mas Group,7176,96819,"We are looking for a Scrum Master skilled in Project Management, Agile, Facilitation. Responsibilities include Ensure team productivity, Facilitate scrum processes, Support agile teams."
Data Engineer,5.0,Lippo Group,Tangerang Selatan,Medan,10001+ employees,2003,Company - Government,Conglomerate,Conglomerate,Sinar Mas Group,5466,96819,"Hiring a Data Engineer experienced with ETL, Hadoop, Python. You will be responsible for Ensure data quality and integrity, Build and maintain data pipelines, Collaborate with data scientists."
UI Designer,4.0,Gudang Garam,Mojokerto,Medan,10001+ employees,1993,Company - Corporation (C Corp),Tobacco,Consumer Goods,"Djarum, Unilever Indonesia, Sampoerna",4823,90120,"Hiring a UI Designer experienced with UI Design, Figma, Sketch. Responsibilities: Ensure design consistency, Work with design tools, Design user interfaces."
UI Designer,4.7,XL Axiata,Kediri,Medan,5001 to 10000 employees,2012,Company - Professional Corporation (PC),Telecommunications,Telecommunications,"Telekomunikasi Selular (Telkomsel), PT Telkom Indonesia, Indosat Ooredoo",5022,67020,"Hiring a UI Designer experienced with Adobe XD, Sketch, UI Design. Responsibilities: Collaborate with developers, Work with design tools, Design user interfaces."
Reinforcement Learning Specialist,4.2,Indosat Ooredoo,Sungai Penuh,Medan,1001 to 5000 employees,2009,Company - Corporation (C Corp),Telecommunications,Telecommunications,"PT Telkom Indonesia, XL Axiata, Telekomunikasi Selular (Telkomsel)",1400,16941,"Join our team as a Reinforcement Learning Specialist. Skills required: Algorithms, Python, TensorFlow. Responsibilities: Conduct experiments, Collaborate with data scientists, Develop RL models."
Computer Vision Engineer,3.2,Alfamart,Bandung,Jakarta,5001 to 10000 employees,2011,Company - Limited Liability Partnership (LLP),Retail,Retail,"Indomaret, Matahari Department Store",3368,61247,"We are looking for a Computer Vision Engineer skilled in Deep Learning, Computer Vision, OpenCV. Responsibilities include Work with image data, Develop computer vision models, Optimize image processing algorithms."
IT Project Manager,4.5,PT Telkom Indonesia,Tanjungbalai,Bandung,10001+ employees,2001,Company - Private,Telecommunications,Telecommunications,"Indosat Ooredoo, XL Axiata, Telekomunikasi Selular (Telkomsel)",3588,66838,"Join our team as an IT Project Manager. Skills required: Scrum, IT Project Management, Agile. Responsibilities: Manage IT projects, Communicate with stakeholders, Ensure project success."
Product Manager,4.9,Alfamart,Jayapura,Jakarta,5001 to 10000 employees,2011,Company - Limited Liability Partnership (LLP),Retail,Retail,"Indomaret, Matahari Department Store",4112,61247,"Hiring a Product Manager experienced with Scrum, Product Management, Product Development. You will be responsible for Communicate with stakeholders, Work with cross-functional teams, Define product vision."
Research Scientist,3.4,Sampoerna,Yogyakarta,Jakarta,10001+ employees,2007,Company - Government,Tobacco,Consumer Goods,"Unilever Indonesia, Djarum, Gudang Garam",4342,59449,"Join us as a Research Scientist. Required skills: Statistics, Python, Data Analysis. Duties: Collaborate with other scientists, Conduct research and experiments, Analyze experimental data."
Data Engineer,4.0,XL Axiata,Palu,Medan,5001 to 10000 employees,2012,Company - Professional Corporation (PC),Telecommunications,Telecommunications,"Telekomunikasi Selular (Telkomsel), Indosat Ooredoo, PT Telkom Indonesia",4379,67020,"Hiring a Data Engineer experienced with Hadoop, Big Data, ETL. You will be responsible for Work with big data technologies, Collaborate with data scientists, Develop ETL processes."
Motion Graphics Designer,2.7,Sampoerna,Salatiga,Jakarta,10001+ employees,2007,Company - Government,Tobacco,Consumer Goods,"Indofood, Djarum, Unilever Indonesia",4201,59449,"Join us as a Motion Graphics Designer. Required skills: Creativity, Cinema 4D, Animation. Duties: Ensure animation quality, Develop visual content, Work with animation tools."
IT Project Manager,4.8,Alfamart,Sungai Penuh,Jakarta,5001 to 10000 employees,2011,Company - Limited Liability Partnership (LLP),Retail,Retail,"Matahari Department Store, Indomaret",3566,61247,"Join our team as an IT Project Manager. Skills required: Agile, Scrum, IT Project Management. Responsibilities: Manage IT projects, Work with IT teams, Ensure project success."
UI Designer,5.0,Telekomunikasi Selular (Telkomsel),Cilegon,Bandung,5001 to 10000 employees,2006,Company - Government,Telecommunications,Telecommunications,"Indosat Ooredoo, PT Telkom Indonesia, XL Axiata",2461,38849,"Hiring a UI Designer experienced with Prototyping, Sketch, Adobe XD. Responsibilities: Collaborate with developers, Create prototypes, Ensure design consistency."
IT Project Manager,3.5,Blue Bird Group,Samarinda,Bandung,1001 to 5000 employees,1996,Company - Government,Transportation,Transportation,"Garuda Indonesia, Astra International",5202,71491,"Join our team as an IT Project Manager. Skills required: Scrum, Leadership, IT Project Management. Responsibilities: Manage project budgets, Communicate with stakeholders, Manage IT projects."
Interaction Designer,4.2,Indomaret,Kendari,Surabaya,10001+ employees,1994,Company - Sole Proprietorship,Retail,Retail,"Alfamart, Matahari Department Store",2700,30683,"We are looking for an Interaction Designer skilled in User Testing, Prototyping, Adobe XD. Responsibilities include Ensure interaction quality, Collaborate with developers, Design interactive experiences."
Web Application Developer,3.9,Indomaret,Bogor,Surabaya,10001+ employees,1994,Company - Sole Proprietorship,Retail,Retail,"Matahari Department Store, Alfamart",2082,30683,"We are looking for a Web Application Developer skilled in Web Development, APIs, JavaScript. Responsibilities include Optimize web application performance, Ensure application security, Work with JavaScript and APIs."
Agile Project Manager,3.3,Astra International,Kupang,Jakarta,5001 to 10000 employees,1999,Company - Public,Automotive,Transportation,"Blue Bird Group, Garuda Indonesia",1938,36409,"We need an Agile Project Manager with skills in Scrum, Agile, Leadership. Main tasks: Facilitate agile processes, Manage agile projects, Collaborate with agile teams."
Graphic Designer,2.6,XL Axiata,Pasuruan,Medan,5001 to 10000 employees,2012,Company - Professional Corporation (PC),Telecommunications,Telecommunications,"Telekomunikasi Selular (Telkomsel), PT Telkom Indonesia, Indosat Ooredoo",3990,67020,"Seeking a Graphic Designer proficient in Creativity, Illustrator, Adobe Photoshop. Responsibilities: Ensure design quality, Work with design tools, Collaborate with marketing teams."
Research Scientist,3.9,Astra International,Tidore Kepulauan,Jakarta,5001 to 10000 employees,1999,Company - Public,Automotive,Transportation,"Blue Bird Group, Garuda Indonesia",2452,36409,"Join us as a Research Scientist. Required skills: R, Statistics, Machine Learning. Duties: Conduct research and experiments, Develop new methodologies, Analyze experimental data."
Data Mining Engineer,4.1,PLN (Perusahaan Listrik Negara),Banjar,Jakarta,5001 to 10000 employees,2012,Company - Government,Energy,Energy,"Bumi Resources, Pertamina",6264,72579,"Seeking a Data Mining Engineer proficient in SQL, Data Mining, R. Responsibilities include Analyze large datasets, Optimize algorithms, Provide actionable insights."
JavaScript Developer,3.8,Sinar Mas Group,Bengkulu,Surabaya,5001 to 10000 employees,2005,Company - S Corporation (S Corp),Conglomerate,Conglomerate,Lippo Group,5409,87535,"Hiring a JavaScript Developer proficient in JavaScript, React, Vue.js. Responsibilities: Work with frameworks like React and Node.js, Develop applications using JavaScript, Collaborate with other developers."
Web Developer,4.4,Bank Mandiri,Singkawang,Padang,1001 to 5000 employees,1996,Company - Subsidiary,Banking,Finance,"Bank Negara Indonesia (BNI), Bank Rakyat Indonesia (BRI), Bank Central Asia (BCA)",722,8279,"We need a Web Developer proficient in JavaScript, CSS, HTML. Responsibilities: Work with HTML, CSS, and JavaScript, Ensure website performance, Collaborate with designers."
Full-stack Developer,4.9,Bukalapak,Pekanbaru,Surabaya,5001 to 10000 employees,2012,Company - Cooperative,E-commerce,Technology,"GoJek, Traveloka, Tokopedia",5243,61130,"We need a Full-stack Developer with skills in HTML, Node.js, React. Main tasks: Work with HTML, CSS, JavaScript, and server-side languages, Collaborate with designers and developers, Ensure full-stack performance."
Graphic Designer,4.8,Sampoerna,Malang,Jakarta,10001+ employees,2007,Company - Government,Tobacco,Consumer Goods,"Djarum, Indofood, Unilever Indonesia",3446,59449,"Seeking a Graphic Designer proficient in Creativity, Graphic Design, Illustrator. Responsibilities: Ensure design quality, Create visual designs, Develop branding materials."
Brand Designer,4.1,Sinar Mas Group,Pematang Siantar,Surabaya,5001 to 10000 employees,2005,Company - S Corporation (S Corp),Conglomerate,Conglomerate,Lippo Group,6826,87535,"Hiring a Brand Designer proficient in Creativity, Adobe Creative Suite, Visual Design. Responsibilities: Develop branding materials, Collaborate with marketing teams, Create visual identities."
Graphic Designer,4.8,Unilever Indonesia,Kendari,Padang,5001 to 10000 employees,2005,Company - Joint Venture,Consumer Goods,Consumer Goods,"Sampoerna, Djarum, Indofood",3982,48010,"Seeking a Graphic Designer proficient in Adobe Photoshop, InDesign, Illustrator. Responsibilities: Ensure design quality, Work with design tools, Collaborate with marketing teams."
Agile Project Manager,3.4,Alfamart,Sawah Lunto,Jakarta,5001 to 10000 employees,2011,Company - Limited Liability Partnership (LLP),Retail,Retail,"Indomaret, Matahari Department Store",4076,61247,"We need an Agile Project Manager with skills in Agile, Scrum, Project Management. Main tasks: Ensure project delivery, Communicate with stakeholders, Facilitate agile processes."
Front-end Developer,4.9,Kalbe Farma,Medan,Bandung,1001 to 5000 employees,1991,Company - Professional Corporation (PC),Pharmaceuticals,Healthcare,,363,5383,"Seeking a Front-end Developer with skills in JavaScript, React, Vue.js. Responsibilities: Ensure responsive design, Develop user interfaces, Optimize front-end performance."
AI Research Scientist,4.4,Telekomunikasi Selular (Telkomsel),Dumai,Bandung,5001 to 10000 employees,2006,Company - Government,Telecommunications,Telecommunications,"XL Axiata, PT Telkom Indonesia, Indosat Ooredoo",2369,38849,"We need an AI Research Scientist with skills in Research, Python, Algorithms. Main tasks: Develop new AI algorithms, Analyze experimental results, Conduct AI research."
Deep Learning Engineer,4.0,Bank Central Asia (BCA),Sorong,Padang,1001 to 5000 employees,1993,Company - Limited Liability Company (LLC),Banking,Finance,"Bank Negara Indonesia (BNI), Bank Rakyat Indonesia (BRI), Bank Mandiri",903,14255,"Hiring a Deep Learning Engineer experienced with Deep Learning, Neural Networks, Keras. You will be responsible for Optimize neural networks, Work with TensorFlow and Keras, Deploy DL solutions."
Web Developer,3.6,Indomaret,Bukittinggi,Surabaya,10001+ employees,1994,Company - Sole Proprietorship,Retail,Retail,"Alfamart, Matahari Department Store",1791,30683,"We need a Web Developer proficient in JavaScript, CSS, HTML. Responsibilities: Develop and maintain websites, Collaborate with designers, Work with HTML, CSS, and JavaScript."
Computer Vision Engineer,5.0,GoJek,Sawah Lunto,Padang,1001 to 5000 employees,2008,Company - Private,E-commerce,Technology,"Tokopedia, Traveloka, Bukalapak",5034,61845,"We are looking for a Computer Vision Engineer skilled in OpenCV, Deep Learning, Image Processing. Responsibilities include Work with image data, Optimize image processing algorithms, Develop computer vision models."
Big Data Specialist,2.9,Garuda Indonesia,Palembang,Jakarta,1001 to 5000 employees,1995,Company - Private,Airlines,Transportation,"Astra International, Blue Bird Group",476,8567,"We are looking for a Big Data Specialist skilled in Big Data, NoSQL, Spark. Responsibilities include Manage and analyze large datasets, Collaborate with data engineers, Ensure data scalability."
UX Designer,3.9,Bank Rakyat Indonesia (BRI),Manado,Yogyakarta,5001 to 10000 employees,2006,Company - Corporation (C Corp),Banking,Finance,"Bank Mandiri, Bank Negara Indonesia (BNI), Bank Central Asia (BCA)",5619,78435,"We need a UX Designer with skills in UX Research, Adobe XD, Prototyping. Main tasks: Ensure usability, Design user experiences, Collaborate with developers."
Robotics Engineer,4.4,Astra International,Padang Sidempuan,Jakarta,5001 to 10000 employees,1999,Company - Public,Automotive,Transportation,"Blue Bird Group, Garuda Indonesia",2258,36409,"Seeking a Robotics Engineer proficient in C++, Robotics, Python. Responsibilities include Develop robotics solutions, Test and optimize robotics algorithms, Collaborate with other engineers."
Front-end Developer,4.4,Unilever Indonesia,Metro,Padang,5001 to 10000 employees,2005,Company - Joint Venture,Consumer Goods,Consumer Goods,"Sampoerna, Gudang Garam, Djarum",2994,48010,"Seeking a Front-end Developer with skills in HTML, Vue.js, CSS. Responsibilities: Optimize front-end performance, Collaborate with back-end developers, Develop user interfaces."
Deep Learning Engineer,4.6,PT Telkom Indonesia,Langsa,Bandung,10001+ employees,2001,Company - Private,Telecommunications,Telecommunications,"XL Axiata, Telekomunikasi Selular (Telkomsel), Indosat Ooredoo",3343,66838,"Hiring a Deep Learning Engineer experienced with Deep Learning, Keras, Neural Networks. You will be responsible for Optimize neural networks, Develop deep learning models, Deploy DL solutions."
Agile Project Manager,3.3,Gudang Garam,Jakarta,Medan,10001+ employees,1993,Company - Corporation (C Corp),Tobacco,Consumer Goods,"Unilever Indonesia, Sampoerna, Indofood",7794,90120,"We need an Agile Project Manager with skills in Project Management, Scrum, Communication. Main tasks: Manage agile projects, Facilitate agile processes, Collaborate with agile teams."
Brand Designer,3.9,Bumi Resources,Gunungsitoli,Jakarta,1001 to 5000 employees,2002,Company - Joint Venture,Mining,Energy,"Pertamina, PLN (Perusahaan Listrik Negara)",4734,89105,"Hiring a Brand Designer proficient in Creativity, Visual Design, Brand Strategy. Responsibilities: Work with design tools, Ensure brand consistency, Collaborate with marketing teams."
