Job Title,Rating,Company Name,Location,Headquarters,Size,Founded,Type of ownership,Industry,Sector,Competitors,Average Salary,Average Revenue,Processed_JD
Data Mining Engineer,4.4,Garuda Indonesia,Gunungsitoli,Jakarta,1001 to 5000 employees,1995,Company - Private,Airlines,Transportation,"Blue Bird Group, Astra International",643,8567,"Seeking a Data Mining Engineer proficient in R, Data Mining, SQL. Responsibilities include Optimize algorithms, Analyze large datasets, Work with data scientists."
Technical Project Manager,4.0,Pertamina,Samarinda,Bandung,5001 to 10000 employees,1990,Company - S Corporation (S Corp),Oil and Gas,Energy,"PLN (Perusahaan Listrik Negara), Bumi Resources",236,2646,"Seeking a Technical Project Manager proficient in Project Management, Agile, Scrum. Responsibilities include Manage project timelines, Ensure project delivery, Work with cross-functional teams."
Graphic Designer,3.8,Tokopedia,Denpasar,Bandung,5001 to 10000 employees,2012,Company - Public,E-commerce,Technology,"Traveloka, Bukalapak, GoJek",1884,28275,"Seeking a Graphic Designer proficient in Graphic Design, Illustrator, Adobe Photoshop. Responsibilities: Develop branding materials, Create visual designs, Ensure design quality."
Web Application Developer,3.3,PT Telkom Indonesia,Bandar Lampung,Bandung,10001+ employees,2001,Company - Private,Telecommunications,Telecommunications,"Indosat Ooredoo, Telekomunikasi Selular (Telkomsel), XL Axiata",4932,66838,"We are looking for a Web Application Developer skilled in HTML, JavaScript, CSS. Responsibilities include Optimize web application performance, Collaborate with designers, Ensure application security."
Research Scientist,3.6,Sinar Mas Group,Jakarta,Surabaya,5001 to 10000 employees,2005,Company - S Corporation (S Corp),Conglomerate,Conglomerate,Lippo Group,5070,87535,"Join us as a Research Scientist. Required skills: Machine Learning, Data Analysis, Statistics. Duties: Collaborate with other scientists, Publish research findings, Conduct research and experiments."
UI Designer,4.7,Indofood,Sungai Penuh,Medan,1001 to 5000 employees,2013,Company - Non-profit,Food and Beverage,Consumer Goods,"Gudang Garam, Sampoerna, Unilever Indonesia",3163,58848,"Hiring a UI Designer experienced with Adobe XD, UI Design, Sketch. Responsibilities: Create prototypes, Collaborate with developers, Ensure design consistency."
Program Manager,3.8,Bank Central Asia (BCA),Bau-Bau,Padang,1001 to 5000 employees,1993,Company - Limited Liability Company (LLC),Banking,Finance,"Bank Negara Indonesia (BNI), Bank Mandiri, Bank Rakyat Indonesia (BRI)",1251,14255,"Join us as a Program Manager. Required skills: Communication, Program Management, Agile. Duties: Manage program budgets, Communicate with stakeholders, Manage programs."
Interaction Designer,3.8,Ciputra Development,Bengkulu,Padang,5001 to 10000 employees,2011,Company - Professional Corporation (PC),Real Estate,Real Estate,,1667,28058,"We are looking for an Interaction Designer skilled in Adobe XD, UI Design, User Testing. Responsibilities include Work with design tools, Design interactive experiences, Collaborate with developers."
JavaScript Developer,3.7,Indofood,Magelang,Medan,1001 to 5000 employees,2013,Company - Non-profit,Food and Beverage,Consumer Goods,"Sampoerna, Gudang Garam, Djarum",4378,58848,"Hiring a JavaScript Developer proficient in JavaScript, Vue.js, Angular. Responsibilities: Ensure code quality, Collaborate with other developers, Work with frameworks like React and Node.js."
UX Designer,4.3,Matahari Department Store,Mojokerto,Bandung,10001+ employees,2001,Company - Sole Proprietorship,Retail,Retail,"Alfamart, Indomaret",5490,74246,"We need a UX Designer with skills in UX Research, Adobe XD, Wireframing. Main tasks: Ensure usability, Collaborate with developers, Create wireframes and prototypes."
Front-end Developer,3.8,XL Axiata,Denpasar,Medan,5001 to 10000 employees,2012,Company - Professional Corporation (PC),Telecommunications,Telecommunications,"Telekomunikasi Selular (Telkomsel), PT Telkom Indonesia, Indosat Ooredoo",4231,67020,"Seeking a Front-end Developer with skills in JavaScript, React, CSS. Responsibilities: Collaborate with back-end developers, Optimize front-end performance, Ensure responsive design."
JavaScript Developer,3.1,Bank Mandiri,Cilegon,Padang,1001 to 5000 employees,1996,Company - Subsidiary,Banking,Finance,"Bank Central Asia (BCA), Bank Negara Indonesia (BNI), Bank Rakyat Indonesia (BRI)",421,8279,"Hiring a JavaScript Developer proficient in Vue.js, Node.js, React. Responsibilities: Ensure code quality, Work with frameworks like React and Node.js, Develop applications using JavaScript."
Research Scientist,2.7,GoJek,Malang,Padang,1001 to 5000 employees,2008,Company - Private,E-commerce,Technology,"Bukalapak, Tokopedia, Traveloka",5088,61845,"Join us as a Research Scientist. Required skills: R, Python, Machine Learning. Duties: Develop new methodologies, Analyze experimental data, Publish research findings."
Data Mining Engineer,5.0,PLN (Perusahaan Listrik Negara),Banjarmasin,Jakarta,5001 to 10000 employees,2012,Company - Government,Energy,Energy,"Pertamina, Bumi Resources",3997,72579,"Seeking a Data Mining Engineer proficient in SQL, R, Algorithms. Responsibilities include Work with data scientists, Analyze large datasets, Develop data mining models."
Interaction Designer,4.2,Indofood,Lubuklinggau,Medan,1001 to 5000 employees,2013,Company - Non-profit,Food and Beverage,Consumer Goods,"Sampoerna, Unilever Indonesia, Gudang Garam",2970,58848,"We are looking for an Interaction Designer skilled in User Testing, Prototyping, UI Design. Responsibilities include Create prototypes, Work with design tools, Design interactive experiences."
Research Scientist,4.5,Indosat Ooredoo,Bontang,Medan,1001 to 5000 employees,2009,Company - Corporation (C Corp),Telecommunications,Telecommunications,"XL Axiata, Telekomunikasi Selular (Telkomsel), PT Telkom Indonesia",1377,16941,"Join us as a Research Scientist. Required skills: R, Python, Data Analysis. Duties: Publish research findings, Collaborate with other scientists, Conduct research and experiments."
Graphic Designer,2.8,Garuda Indonesia,Banjarmasin,Jakarta,1001 to 5000 employees,1995,Company - Private,Airlines,Transportation,"Blue Bird Group, Astra International",754,8567,"Seeking a Graphic Designer proficient in Creativity, Graphic Design, Adobe Photoshop. Responsibilities: Create visual designs, Ensure design quality, Work with design tools."
JavaScript Developer,4.3,Lippo Group,Langsa,Medan,10001+ employees,2003,Company - Government,Conglomerate,Conglomerate,Sinar Mas Group,6613,96819,"Hiring a JavaScript Developer proficient in JavaScript, Node.js, React. Responsibilities: Work with frameworks like React and Node.js, Optimize JavaScript performance, Ensure code quality."
Interaction Designer,4.4,PT Telkom Indonesia,Sabang,Bandung,10001+ employees,2001,Company - Private,Telecommunications,Telecommunications,"Indosat Ooredoo, XL Axiata, Telekomunikasi Selular (Telkomsel)",3453,66838,"We are looking for an Interaction Designer skilled in Prototyping, UI Design, Adobe XD. Responsibilities include Collaborate with developers, Work with design tools, Design interactive experiences."
Web Application Developer,3.2,Bank Rakyat Indonesia (BRI),Banda Aceh,Yogyakarta,5001 to 10000 employees,2006,Company - Corporation (C Corp),Banking,Finance,"Bank Negara Indonesia (BNI), Bank Mandiri, Bank Central Asia (BCA)",5804,78435,"We are looking for a Web Application Developer skilled in CSS, JavaScript, HTML. Responsibilities include Develop web applications, Optimize web application performance, Work with JavaScript and APIs."
IT Project Manager,3.9,Ciputra Development,Magelang,Padang,5001 to 10000 employees,2011,Company - Professional Corporation (PC),Real Estate,Real Estate,,1758,28058,"Join our team as an IT Project Manager. Skills required: IT Project Management, Leadership, Technical Background. Responsibilities: Manage project budgets, Work with IT teams, Ensure project success."
UI/UX Developer,3.8,Tokopedia,Tebing Tinggi,Bandung,5001 to 10000 employees,2012,Company - Public,E-commerce,Technology,"GoJek, Traveloka, Bukalapak",1462,28275,"Join us as a UI/UX Developer. Required skills: Sketch, UI Design, Adobe XD. Duties: Conduct user research, Design user interfaces and experiences, Create prototypes."
Data Mining Engineer,2.9,Bank Negara Indonesia (BNI),Surakarta,Bandung,10001+ employees,2007,Company - Partnership,Banking,Finance,"Bank Mandiri, Bank Rakyat Indonesia (BRI), Bank Central Asia (BCA)",8060,96697,"Seeking a Data Mining Engineer proficient in R, Python, SQL. Responsibilities include Work with data scientists, Develop data mining models, Provide actionable insights."
Data Scientist,3.4,Gudang Garam,Yogyakarta,Medan,10001+ employees,1993,Company - Corporation (C Corp),Tobacco,Consumer Goods,"Indofood, Sampoerna, Djarum",4560,90120,"We are looking for a Data Scientist to join our team. Requirements: Experience in SQL, R, Machine Learning. Responsibilities: Collaborate with cross-functional teams, Develop predictive models, Communicate findings to stakeholders."
Reinforcement Learning Specialist,4.7,Djarum,Bandar Lampung,Medan,5001 to 10000 employees,1991,Company - S Corporation (S Corp),Tobacco,Consumer Goods,"Unilever Indonesia, Gudang Garam, Indofood",5132,73942,"Join our team as a Reinforcement Learning Specialist. Skills required: TensorFlow, Machine Learning, Algorithms. Responsibilities: Optimize RL algorithms, Work with TensorFlow and PyTorch, Collaborate with data scientists."
Data Analyst,4.0,Gudang Garam,Sorong,Medan,10001+ employees,1993,Company - Corporation (C Corp),Tobacco,Consumer Goods,"Indofood, Unilever Indonesia, Djarum",7418,90120,"Seeking a Data Analyst proficient in Excel, Power BI, SQL. Responsibilities include Support data-driven decision making, Identify trends and patterns, Create reports and dashboards."
Robotics Engineer,2.8,Matahari Department Store,Kediri,Bandung,10001+ employees,2001,Company - Sole Proprietorship,Retail,Retail,"Indomaret, Alfamart",6660,74246,"Seeking a Robotics Engineer proficient in Python, ROS, C++. Responsibilities include Develop robotics solutions, Test and optimize robotics algorithms, Work with control systems."
Full-stack Developer,3.6,Sinar Mas Group,Denpasar,Surabaya,5001 to 10000 employees,2005,Company - S Corporation (S Corp),Conglomerate,Conglomerate,Lippo Group,5380,87535,"We need a Full-stack Developer with skills in React, HTML, JavaScript. Main tasks: Collaborate with designers and developers, Optimize full-stack applications, Develop both front-end and back-end."
NLP Engineer (Natural Language Processing),3.4,Lippo Group,Pontianak,Medan,10001+ employees,2003,Company - Government,Conglomerate,Conglomerate,Sinar Mas Group,8197,96819,"Join us as an NLP Engineer. Required skills: Text Mining, NLP, Python. Duties: Work with text data, Develop NLP models, Use NLP libraries."
Data Mining Engineer,4.0,Telekomunikasi Selular (Telkomsel),Cimahi,Bandung,5001 to 10000 employees,2006,Company - Government,Telecommunications,Telecommunications,"Indosat Ooredoo, XL Axiata, PT Telkom Indonesia",2940,38849,"Seeking a Data Mining Engineer proficient in SQL, Algorithms, R. Responsibilities include Work with data scientists, Provide actionable insights, Optimize algorithms."
Scrum Master,3.6,Bumi Resources,Pekanbaru,Jakarta,1001 to 5000 employees,2002,Company - Joint Venture,Mining,Energy,"PLN (Perusahaan Listrik Negara), Pertamina",4832,89105,"We are looking for a Scrum Master skilled in Agile, Project Management, Scrum. Responsibilities include Communicate with stakeholders, Ensure team productivity, Support agile teams."
Technical Project Manager,2.8,GoJek,Binjai,Padang,1001 to 5000 employees,2008,Company - Private,E-commerce,Technology,"Bukalapak, Traveloka, Tokopedia",5331,61845,"Seeking a Technical Project Manager proficient in Technical Background, Project Management, Agile. Responsibilities include Manage technical projects, Ensure project delivery, Manage project timelines."
UI Designer,4.1,Bank Central Asia (BCA),Tasikmalaya,Padang,1001 to 5000 employees,1993,Company - Limited Liability Company (LLC),Banking,Finance,"Bank Mandiri, Bank Rakyat Indonesia (BRI), Bank Negara Indonesia (BNI)",762,14255,"Hiring a UI Designer experienced with UI Design, Prototyping, Sketch. Responsibilities: Ensure design consistency, Create prototypes, Collaborate with developers."
Big Data Specialist,3.5,Bank Mandiri,Bengkulu,Padang,1001 to 5000 employees,1996,Company - Subsidiary,Banking,Finance,"Bank Central Asia (BCA), Bank Negara Indonesia (BNI), Bank Rakyat Indonesia (BRI)",419,8279,"We are looking for a Big Data Specialist skilled in NoSQL, Spark, Hadoop. Responsibilities include Ensure data scalability, Work with Hadoop and Spark, Manage and analyze large datasets."
Product Manager,3.7,Traveloka,Bukittinggi,Padang,10001+ employees,2013,Company - Partnership,E-commerce,Technology,"GoJek, Bukalapak, Tokopedia",3900,72987,"Hiring a Product Manager experienced with Product Development, Product Management, Scrum. You will be responsible for Define product vision, Work with cross-functional teams, Communicate with stakeholders."
Data Engineer,3.5,Sampoerna,Pontianak,Jakarta,10001+ employees,2007,Company - Government,Tobacco,Consumer Goods,"Djarum, Gudang Garam, Indofood",3940,59449,"Hiring a Data Engineer experienced with SQL, ETL, Big Data. You will be responsible for Collaborate with data scientists, Work with big data technologies, Develop ETL processes."
Graphic Designer,4.7,Indosat Ooredoo,Tarakan,Medan,1001 to 5000 employees,2009,Company - Corporation (C Corp),Telecommunications,Telecommunications,"XL Axiata, PT Telkom Indonesia, Telekomunikasi Selular (Telkomsel)",868,16941,"Seeking a Graphic Designer proficient in InDesign, Illustrator, Graphic Design. Responsibilities: Create visual designs, Work with design tools, Develop branding materials."
Data Scientist,2.8,Blue Bird Group,Pontianak,Bandung,1001 to 5000 employees,1996,Company - Government,Transportation,Transportation,"Astra International, Garuda Indonesia",4662,71491,"We are looking for a Data Scientist to join our team. Requirements: Experience in Data Analysis, R, Python. Responsibilities: Communicate findings to stakeholders, Analyze data to drive insights, Develop predictive models."
JavaScript Developer,2.9,GoJek,Tangerang,Padang,1001 to 5000 employees,2008,Company - Private,E-commerce,Technology,"Tokopedia, Bukalapak, Traveloka",4081,61845,"Hiring a JavaScript Developer proficient in Vue.js, Angular, Node.js. Responsibilities: Optimize JavaScript performance, Develop applications using JavaScript, Work with frameworks like React and Node.js."
Interaction Designer,3.7,Indomaret,Subulussalam,Surabaya,10001+ employees,1994,Company - Sole Proprietorship,Retail,Retail,"Matahari Department Store, Alfamart",2380,30683,"We are looking for an Interaction Designer skilled in Adobe XD, Prototyping, Interaction Design. Responsibilities include Create prototypes, Collaborate with developers, Ensure interaction quality."
AI Research Scientist,3.8,Indomaret,Tanjungbalai,Surabaya,10001+ employees,1994,Company - Sole Proprietorship,Retail,Retail,"Matahari Department Store, Alfamart",2455,30683,"We need an AI Research Scientist with skills in Python, Machine Learning, Research. Main tasks: Develop new AI algorithms, Collaborate with other researchers, Publish research papers."
UI Designer,4.2,Ciputra Development,Balikpapan,Padang,5001 to 10000 employees,2011,Company - Professional Corporation (PC),Real Estate,Real Estate,,2133,28058,"Hiring a UI Designer experienced with Figma, UI Design, Adobe XD. Responsibilities: Ensure design consistency, Collaborate with developers, Work with design tools."
UI/UX Developer,4.8,Bukalapak,Yogyakarta,Surabaya,5001 to 10000 employees,2012,Company - Cooperative,E-commerce,Technology,"GoJek, Tokopedia, Traveloka",4272,61130,"Join us as a UI/UX Developer. Required skills: UX Research, UI Design, Adobe XD. Duties: Work with design tools, Collaborate with developers, Create prototypes."
Motion Graphics Designer,3.5,GoJek,Sabang,Padang,1001 to 5000 employees,2008,Company - Private,E-commerce,Technology,"Traveloka, Bukalapak, Tokopedia",3837,61845,"Join us as a Motion Graphics Designer. Required skills: After Effects, Cinema 4D, Creativity. Duties: Create motion graphics, Ensure animation quality, Work with animation tools."
Full-stack Developer,3.8,Garuda Indonesia,Yogyakarta,Jakarta,1001 to 5000 employees,1995,Company - Private,Airlines,Transportation,"Astra International, Blue Bird Group",732,8567,"We need a Full-stack Developer with skills in React, Node.js, JavaScript. Main tasks: Develop both front-end and back-end, Ensure full-stack performance, Work with HTML, CSS, JavaScript, and server-side languages."
Front-end Developer,4.0,Bukalapak,Mojokerto,Surabaya,5001 to 10000 employees,2012,Company - Cooperative,E-commerce,Technology,"Traveloka, GoJek, Tokopedia",5496,61130,"Seeking a Front-end Developer with skills in React, Vue.js, JavaScript. Responsibilities: Collaborate with back-end developers, Develop user interfaces, Work with HTML, CSS, and JavaScript."
UI Designer,3.7,Astra International,Palangka Raya,Jakarta,5001 to 10000 employees,1999,Company - Public,Automotive,Transportation,"Blue Bird Group, Garuda Indonesia",2370,36409,"Hiring a UI Designer experienced with Prototyping, Sketch, UI Design. Responsibilities: Collaborate with developers, Work with design tools, Ensure design consistency."
Business Intelligence Analyst,4.5,Telekomunikasi Selular (Telkomsel),Prabumulih,Bandung,5001 to 10000 employees,2006,Company - Government,Telecommunications,Telecommunications,"PT Telkom Indonesia, XL Axiata, Indosat Ooredoo",3056,38849,"We need a Business Intelligence Analyst with skills in Data Modeling, Analytics, Dashboarding. Main tasks: Work with business stakeholders, Provide actionable insights, Develop BI solutions."
Web Application Developer,4.2,Tokopedia,Binjai,Bandung,5001 to 10000 employees,2012,Company - Public,E-commerce,Technology,"Traveloka, GoJek, Bukalapak",1681,28275,"We are looking for a Web Application Developer skilled in APIs, JavaScript, CSS. Responsibilities include Ensure application security, Work with JavaScript and APIs, Collaborate with designers."
Scrum Master,3.3,Matahari Department Store,Banjarmasin,Bandung,10001+ employees,2001,Company - Sole Proprietorship,Retail,Retail,"Indomaret, Alfamart",3773,74246,"We are looking for a Scrum Master skilled in Agile, Facilitation, Team Collaboration. Responsibilities include Support agile teams, Ensure team productivity, Remove obstacles."
Front-end Developer,3.1,Traveloka,Pontianak,Padang,10001+ employees,2013,Company - Partnership,E-commerce,Technology,"Tokopedia, GoJek, Bukalapak",4729,72987,"Seeking a Front-end Developer with skills in Vue.js, JavaScript, HTML. Responsibilities: Optimize front-end performance, Ensure responsive design, Collaborate with back-end developers."
Product Manager,4.8,XL Axiata,Malang,Medan,5001 to 10000 employees,2012,Company - Professional Corporation (PC),Telecommunications,Telecommunications,"Indosat Ooredoo, PT Telkom Indonesia, Telekomunikasi Selular (Telkomsel)",5661,67020,"Hiring a Product Manager experienced with Agile, Product Development, Leadership. You will be responsible for Work with cross-functional teams, Manage product lifecycle, Communicate with stakeholders."
Data Mining Engineer,4.5,Ciputra Development,Banjar,Padang,5001 to 10000 employees,2011,Company - Professional Corporation (PC),Real Estate,Real Estate,,2349,28058,"Seeking a Data Mining Engineer proficient in Data Mining, Algorithms, SQL. Responsibilities include Provide actionable insights, Analyze large datasets, Work with data scientists."
Big Data Specialist,5.0,Bukalapak,Gunungsitoli,Surabaya,5001 to 10000 employees,2012,Company - Cooperative,E-commerce,Technology,"GoJek, Traveloka, Tokopedia",3666,61130,"We are looking for a Big Data Specialist skilled in Spark, Python, NoSQL. Responsibilities include Collaborate with data engineers, Work with Hadoop and Spark, Manage and analyze large datasets."
Full-stack Developer,2.9,Bukalapak,Malang,Surabaya,5001 to 10000 employees,2012,Company - Cooperative,E-commerce,Technology,"GoJek, Traveloka, Tokopedia",3787,61130,"We need a Full-stack Developer with skills in Node.js, CSS, HTML. Main tasks: Work with HTML, CSS, JavaScript, and server-side languages, Develop both front-end and back-end, Ensure full-stack performance."
Back-end Developer,2.6,Astra International,Tangerang Selatan,Jakarta,5001 to 10000 employees,1999,Company - Public,Automotive,Transportation,"Blue Bird Group, Garuda Indonesia",1975,36409,"Hiring a Back-end Developer experienced with Java, APIs, Python. Responsibilities: Collaborate with front-end developers, Ensure application performance, Work with databases."
UI Designer,4.0,Ciputra Development,Medan,Padang,5001 to 10000 employees,2011,Company - Professional Corporation (PC),Real Estate,Real Estate,,1858,28058,"Hiring a UI Designer experienced with Sketch, Adobe XD, UI Design. Responsibilities: Work with design tools, Design user interfaces, Collaborate with developers."
Big Data Specialist,5.0,Garuda Indonesia,Depok,Jakarta,1001 to 5000 employees,1995,Company - Private,Airlines,Transportation,"Blue Bird Group, Astra International",673,8567,"We are looking for a Big Data Specialist skilled in Spark, Python, Big Data. Responsibilities include Collaborate with data engineers, Develop big data solutions, Ensure data scalability."
Full-stack Developer,3.8,Lippo Group,Cirebon,Medan,10001+ employees,2003,Company - Government,Conglomerate,Conglomerate,Sinar Mas Group,4968,96819,"We need a Full-stack Developer with skills in React, HTML, Node.js. Main tasks: Work with HTML, CSS, JavaScript, and server-side languages, Ensure full-stack performance, Collaborate with designers and developers."
Big Data Specialist,3.8,Alfamart,Banjar,Jakarta,5001 to 10000 employees,2011,Company - Limited Liability Partnership (LLP),Retail,Retail,"Indomaret, Matahari Department Store",4175,61247,"We are looking for a Big Data Specialist skilled in Spark, Big Data, Hadoop. Responsibilities include Ensure data scalability, Manage and analyze large datasets, Work with Hadoop and Spark."
Business Intelligence Analyst,4.7,Indofood,Pasuruan,Medan,1001 to 5000 employees,2013,Company - Non-profit,Food and Beverage,Consumer Goods,"Unilever Indonesia, Gudang Garam, Djarum",4581,58848,"We need a Business Intelligence Analyst with skills in Data Modeling, BI Tools, Dashboarding. Main tasks: Provide actionable insights, Analyze data trends, Create and maintain dashboards."
Data Analyst,4.2,Lippo Group,Tarakan,Medan,10001+ employees,2003,Company - Government,Conglomerate,Conglomerate,Sinar Mas Group,8481,96819,"Seeking a Data Analyst proficient in Tableau, SQL, Excel. Responsibilities include Identify trends and patterns, Support data-driven decision making, Create reports and dashboards."
Front-end Developer,3.0,GoJek,Prabumulih,Padang,1001 to 5000 employees,2008,Company - Private,E-commerce,Technology,"Tokopedia, Bukalapak, Traveloka",4007,61845,"Seeking a Front-end Developer with skills in React, JavaScript, HTML. Responsibilities: Collaborate with back-end developers, Optimize front-end performance, Develop user interfaces."
AI Research Scientist,4.2,Kalbe Farma,Madiun,Bandung,1001 to 5000 employees,1991,Company - Professional Corporation (PC),Pharmaceuticals,Healthcare,,353,5383,"We need an AI Research Scientist with skills in Research, Machine Learning, Python. Main tasks: Conduct AI research, Analyze experimental results, Collaborate with other researchers."
Data Engineer,3.1,GoJek,Bandar Lampung,Padang,1001 to 5000 employees,2008,Company - Private,E-commerce,Technology,"Tokopedia, Bukalapak, Traveloka",3170,61845,"Hiring a Data Engineer experienced with Hadoop, SQL, ETL. You will be responsible for Develop ETL processes, Build and maintain data pipelines, Ensure data quality and integrity."
Computer Vision Engineer,3.7,Bank Negara Indonesia (BNI),Malang,Bandung,10001+ employees,2007,Company - Partnership,Banking,Finance,"Bank Central Asia (BCA), Bank Mandiri, Bank Rakyat Indonesia (BRI)",5502,96697,"We are looking for a Computer Vision Engineer skilled in Image Processing, Python, Computer Vision. Responsibilities include Use OpenCV and TensorFlow, Optimize image processing algorithms, Collaborate with data scientists."
Data Mining Engineer,2.5,Indomaret,Jambi,Surabaya,10001+ employees,1994,Company - Sole Proprietorship,Retail,Retail,"Alfamart, Matahari Department Store",2543,30683,"Seeking a Data Mining Engineer proficient in Data Mining, Algorithms, SQL. Responsibilities include Optimize algorithms, Analyze large datasets, Provide actionable insights."
Deep Learning Engineer,4.9,Unilever Indonesia,Ambon,Padang,5001 to 10000 employees,2005,Company - Joint Venture,Consumer Goods,Consumer Goods,"Indofood, Gudang Garam, Djarum",4243,48010,"Hiring a Deep Learning Engineer experienced with TensorFlow, Neural Networks, Python. You will be responsible for Work with TensorFlow and Keras, Deploy DL solutions, Collaborate with data scientists."
Agile Project Manager,5.0,Indomaret,Payakumbuh,Surabaya,10001+ employees,1994,Company - Sole Proprietorship,Retail,Retail,"Alfamart, Matahari Department Store",2467,30683,"We need an Agile Project Manager with skills in Scrum, Communication, Leadership. Main tasks: Manage agile projects, Collaborate with agile teams, Facilitate agile processes."
