Job Title,Rating,Company Name,Location,Headquarters,Size,Founded,Type of ownership,Industry,Sector,Competitors,Average Salary,Average Revenue,Processed_JD
Technical Project Manager,5.0,Blue Bird Group,Malang,Bandar Lampung,10001+ employees,2001,Company - Non-profit,Transportation,Transportation,"Astra International, Garuda Indonesia",847.6,96217.0,"Seeking a Technical Project Manager proficient in Technical Background, Agile, Project Management. Responsibilities include Work with cross-functional teams, Manage project timelines, Communicate with stakeholders."
Front-end Developer,3.3,Sinar Mas Group,Jakarta,Ternate,5001 to 10000 employees,1991,Company - Subsidiary,Conglomerate,Conglomerate,Lippo Group,638.3,66392.9,"Seeking a Front-end Developer with skills in CSS, JavaScript, HTML. Responsibilities: Develop user interfaces, Work with HTML, CSS, and JavaScript, Collaborate with back-end developers."
Research Scientist,4.4,Matahari Department Store,Pangkal Pinang,Pariaman,1001 to 5000 employees,1992,Company - Corporation (C Corp),Retail,Retail,"Alfamart, Indomaret",811.7,87252.2,"Join us as a Research Scientist. Required skills: Data Analysis, Python, Statistics. Duties: Publish research findings, Analyze experimental data, Conduct research and experiments."
Front-end Developer,4.6,Bank Rakyat Indonesia (BRI),Denpasar,Tomohon,5001 to 10000 employees,2003,Company - Limited Partnership (LP),Banking,Finance,"Bank Mandiri, Bank Central Asia (BCA), Bank Negara Indonesia (BNI)",1175.8,52256.9,"Seeking a Front-end Developer with skills in React, Vue.js, JavaScript. Responsibilities: Work with HTML, CSS, and JavaScript, Collaborate with back-end developers, Develop user interfaces."
UX Designer,2.7,PLN (Perusahaan Listrik Negara),Kotamobagu,Pekalongan,5001 to 10000 employees,1993,Company - Sole Proprietorship,Energy,Energy,"Pertamina, Bumi Resources",1489.5,13601.5,"We need a UX Designer with skills in Prototyping, Adobe XD, UX Research. Main tasks: Design user experiences, Ensure usability, Conduct user research."
JavaScript Developer,2.9,PLN (Perusahaan Listrik Negara),Subulussalam,Tarakan,1001 to 5000 employees,2006,Company - Non-profit,Energy,Energy,"Pertamina, Bumi Resources",819.7,50060.8,"Hiring a JavaScript Developer proficient in Node.js, React, JavaScript. Responsibilities: Develop applications using JavaScript, Optimize JavaScript performance, Ensure code quality."
UI/UX Developer,2.9,Bukalapak,Dumai,Subulussalam,5001 to 10000 employees,2001,Company - S Corporation (S Corp),E-commerce,Technology,"Tokopedia, GoJek, Traveloka",288.8,99459.1,"Join us as a UI/UX Developer. Required skills: UI Design, UX Research, Adobe XD. Duties: Design user interfaces and experiences, Conduct user research, Work with design tools."
Back-end Developer,4.0,Bumi Resources,Ambon,Pematang Siantar,1001 to 5000 employees,1994,Company - Professional Corporation (PC),Mining,Energy,"Pertamina, PLN (Perusahaan Listrik Negara)",1372.2,1577.3,"Hiring a Back-end Developer experienced with Node.js, Java, APIs. Responsibilities: Collaborate with front-end developers, Work with databases, Develop server-side logic."
UI Designer,4.7,Bank Rakyat Indonesia (BRI),Bekasi,Padang,5001 to 10000 employees,2003,Company - Professional Corporation (PC),Banking,Finance,"Bank Mandiri, Bank Negara Indonesia (BNI), Bank Central Asia (BCA)",151.7,34322.2,"Hiring a UI Designer experienced with Adobe XD, UI Design, Figma. Responsibilities: Work with design tools, Collaborate with developers, Create prototypes."
JavaScript Developer,4.3,Sampoerna,Tidore Kepulauan,Madiun,5001 to 10000 employees,1990,Company - Government,Tobacco,Consumer Goods,"Djarum, Gudang Garam, Indofood",922.4,17217.2,"Hiring a JavaScript Developer proficient in Angular, React, JavaScript. Responsibilities: Collaborate with other developers, Optimize JavaScript performance, Work with frameworks like React and Node.js."
UI Designer,3.7,Blue Bird Group,Gorontalo,Bekasi,1001 to 5000 employees,2010,Company - Subsidiary,Transportation,Transportation,"Astra International, Garuda Indonesia",1355.2,31238.1,"Hiring a UI Designer experienced with Adobe XD, UI Design, Prototyping. Responsibilities: Design user interfaces, Ensure design consistency, Collaborate with developers."
UI Designer,4.0,Sampoerna,Semarang,Surakarta,5001 to 10000 employees,2013,Company - Sole Proprietorship,Tobacco,Consumer Goods,"Unilever Indonesia, Djarum, Gudang Garam",371.8,18240.3,"Hiring a UI Designer experienced with Figma, Adobe XD, Prototyping. Responsibilities: Design user interfaces, Create prototypes, Work with design tools."
Machine Learning Engineer,4.4,PT Telkom Indonesia,Cilegon,Pekanbaru,5001 to 10000 employees,1990,Company - Private,Telecommunications,Telecommunications,"Indosat Ooredoo, Telekomunikasi Selular (Telkomsel), XL Axiata",357.9,14918.9,"Join our team as a Machine Learning Engineer. Skills required: Deep Learning, TensorFlow, NLP. Responsibilities: Deploy ML solutions, Collaborate with data scientists, Work with TensorFlow and PyTorch."
Business Intelligence Analyst,2.6,Unilever Indonesia,Pangkal Pinang,Bitung,1001 to 5000 employees,2009,Company - Limited Liability Partnership (LLP),Consumer Goods,Consumer Goods,"Gudang Garam, Djarum, Indofood",1467.4,84482.7,"We need a Business Intelligence Analyst with skills in Dashboarding, Data Modeling, SQL. Main tasks: Create and maintain dashboards, Develop BI solutions, Work with business stakeholders."
IT Project Manager,2.5,Telekomunikasi Selular (Telkomsel),Depok,Pagar Alam,1001 to 5000 employees,1997,Company - Subsidiary,Telecommunications,Telecommunications,"PT Telkom Indonesia, XL Axiata, Indosat Ooredoo",116.9,33018.5,"Join our team as an IT Project Manager. Skills required: Technical Background, Agile, IT Project Management. Responsibilities: Manage IT projects, Work with IT teams, Communicate with stakeholders."
Machine Learning Engineer,4.9,Ciputra Development,Ternate,Pagar Alam,1001 to 5000 employees,2006,Company - Private,Real Estate,Real Estate,,831.7,18802.1,"Join our team as a Machine Learning Engineer. Skills required: TensorFlow, Deep Learning, Scikit-Learn. Responsibilities: Develop machine learning models, Work with TensorFlow and PyTorch, Deploy ML solutions."
Front-end Developer,3.3,Bank Rakyat Indonesia (BRI),Gorontalo,Pagar Alam,1001 to 5000 employees,2005,Company - Limited Liability Partnership (LLP),Banking,Finance,"Bank Central Asia (BCA), Bank Negara Indonesia (BNI), Bank Mandiri",1283.4,21511.3,"Seeking a Front-end Developer with skills in CSS, Vue.js, HTML. Responsibilities: Develop user interfaces, Collaborate with back-end developers, Ensure responsive design."
Web Application Developer,4.5,PLN (Perusahaan Listrik Negara),Subulussalam,Binjai,1001 to 5000 employees,2004,Company - Professional Corporation (PC),Energy,Energy,"Bumi Resources, Pertamina",315.9,2082.8,"We are looking for a Web Application Developer skilled in Web Development, HTML, JavaScript. Responsibilities include Develop web applications, Optimize web application performance, Ensure application security."
Technical Project Manager,4.2,Telekomunikasi Selular (Telkomsel),Surabaya,Gorontalo,1001 to 5000 employees,2001,Company - Cooperative,Telecommunications,Telecommunications,"XL Axiata, PT Telkom Indonesia, Indosat Ooredoo",1010.4,86184.7,"Seeking a Technical Project Manager proficient in Scrum, Agile, Technical Background. Responsibilities include Ensure project delivery, Work with cross-functional teams, Manage technical projects."
Machine Learning Engineer,3.7,Pertamina,Tarakan,Magelang,10001+ employees,1996,Company - Corporation (C Corp),Oil and Gas,Energy,"Bumi Resources, PLN (Perusahaan Listrik Negara)",517.4,78734.7,"Join our team as a Machine Learning Engineer. Skills required: TensorFlow, Scikit-Learn, Deep Learning. Responsibilities: Deploy ML solutions, Work with TensorFlow and PyTorch, Collaborate with data scientists."
Data Scientist,4.4,PLN (Perusahaan Listrik Negara),Depok,Blitar,1001 to 5000 employees,2011,Company - Professional Corporation (PC),Energy,Energy,"Bumi Resources, Pertamina",1423.9,72317.0,"We are looking for a Data Scientist to join our team. Requirements: Experience in Data Analysis, SQL, Machine Learning. Responsibilities: Communicate findings to stakeholders, Develop predictive models, Analyze data to drive insights."
Big Data Specialist,4.8,Matahari Department Store,Prabumulih,Tidore Kepulauan,10001+ employees,2010,Company - Limited Liability Partnership (LLP),Retail,Retail,"Indomaret, Alfamart",1273.9,38165.1,"We are looking for a Big Data Specialist skilled in Python, Big Data, Hadoop. Responsibilities include Ensure data scalability, Manage and analyze large datasets, Work with Hadoop and Spark."
Motion Graphics Designer,2.9,Alfamart,Parepare,Solok,10001+ employees,2006,Company - Limited Partnership (LP),Retail,Retail,"Matahari Department Store, Indomaret",1301.4,57989.9,"Join us as a Motion Graphics Designer. Required skills: Cinema 4D, After Effects, Motion Graphics. Duties: Collaborate with video production teams, Create motion graphics, Ensure animation quality."
Product Manager,4.5,Lippo Group,Blitar,Parepare,5001 to 10000 employees,1994,Company - S Corporation (S Corp),Conglomerate,Conglomerate,Sinar Mas Group,1038.8,98659.3,"Hiring a Product Manager experienced with Product Development, Scrum, Product Management. You will be responsible for Manage product lifecycle, Ensure product success, Define product vision."
Front-end Developer,4.1,Gudang Garam,Jambi,Cimahi,10001+ employees,2011,Company - Cooperative,Tobacco,Consumer Goods,"Sampoerna, Djarum, Unilever Indonesia",766.6,6576.8,"Seeking a Front-end Developer with skills in Vue.js, CSS, JavaScript. Responsibilities: Ensure responsive design, Collaborate with back-end developers, Optimize front-end performance."
Machine Learning Engineer,3.4,Bank Mandiri,Tangerang,Yogyakarta,10001+ employees,1993,Company - Non-profit,Banking,Finance,"Bank Central Asia (BCA), Bank Negara Indonesia (BNI), Bank Rakyat Indonesia (BRI)",1093.7,32122.4,"Join our team as a Machine Learning Engineer. Skills required: NLP, Python, TensorFlow. Responsibilities: Collaborate with data scientists, Develop machine learning models, Deploy ML solutions."
Scrum Master,4.4,Bumi Resources,Padang Panjang,Pasuruan,5001 to 10000 employees,1990,Company - Holding,Mining,Energy,"PLN (Perusahaan Listrik Negara), Pertamina",322.1,87297.3,"We are looking for a Scrum Master skilled in Project Management, Scrum, Facilitation. Responsibilities include Remove obstacles, Ensure team productivity, Communicate with stakeholders."
IT Project Manager,4.5,Telekomunikasi Selular (Telkomsel),Malang,Blitar,10001+ employees,2001,Company - Government,Telecommunications,Telecommunications,"Indosat Ooredoo, PT Telkom Indonesia, XL Axiata",597.1,56527.8,"Join our team as an IT Project Manager. Skills required: Technical Background, Scrum, Agile. Responsibilities: Work with IT teams, Manage IT projects, Manage project budgets."
Brand Designer,2.7,Ciputra Development,Cimahi,Pontianak,5001 to 10000 employees,2008,Company - Public,Real Estate,Real Estate,,1175.0,42952.3,"Hiring a Brand Designer proficient in Adobe Creative Suite, Graphic Design, Brand Strategy. Responsibilities: Develop branding materials, Create visual identities, Work with design tools."
Technical Project Manager,4.7,GoJek,Solok,Bandar Lampung,5001 to 10000 employees,1997,Company - Joint Venture,E-commerce,Technology,"Traveloka, Tokopedia, Bukalapak",525.3,99351.0,"Seeking a Technical Project Manager proficient in Agile, Technical Background, Scrum. Responsibilities include Manage project timelines, Manage technical projects, Communicate with stakeholders."
Front-end Developer,4.5,Astra International,Tangerang Selatan,Banda Aceh,1001 to 5000 employees,2006,Company - Corporation (C Corp),Automotive,Transportation,"Blue Bird Group, Garuda Indonesia",1298.2,29527.4,"Seeking a Front-end Developer with skills in Vue.js, React, HTML. Responsibilities: Collaborate with back-end developers, Work with HTML, CSS, and JavaScript, Ensure responsive design."
Web Application Developer,3.7,Bank Central Asia (BCA),Tidore Kepulauan,Malang,10001+ employees,2005,Company - Corporation (C Corp),Banking,Finance,"Bank Rakyat Indonesia (BRI), Bank Negara Indonesia (BNI), Bank Mandiri",1438.4,44705.8,"We are looking for a Web Application Developer skilled in CSS, JavaScript, HTML. Responsibilities include Optimize web application performance, Develop web applications, Ensure application security."
JavaScript Developer,3.3,Lippo Group,Jakarta,Kotamobagu,5001 to 10000 employees,2008,Company - Joint Venture,Conglomerate,Conglomerate,Sinar Mas Group,97.6,26024.1,"Hiring a JavaScript Developer proficient in JavaScript, Vue.js, Node.js. Responsibilities: Develop applications using JavaScript, Optimize JavaScript performance, Collaborate with other developers."
Scrum Master,2.9,Telekomunikasi Selular (Telkomsel),Tebing Tinggi,Malang,1001 to 5000 employees,1992,Company - Private,Telecommunications,Telecommunications,"Indosat Ooredoo, XL Axiata, PT Telkom Indonesia",32.8,5711.4,"We are looking for a Scrum Master skilled in Agile, Project Management, Facilitation. Responsibilities include Remove obstacles, Support agile teams, Facilitate scrum processes."
UI/UX Developer,3.0,Bank Mandiri,Tegal,Depok,1001 to 5000 employees,2011,Company - S Corporation (S Corp),Banking,Finance,"Bank Rakyat Indonesia (BRI), Bank Central Asia (BCA), Bank Negara Indonesia (BNI)",1284.7,69833.4,"Join us as a UI/UX Developer. Required skills: Prototyping, UX Research, UI Design. Duties: Conduct user research, Work with design tools, Design user interfaces and experiences."
Agile Project Manager,4.5,Bank Negara Indonesia (BNI),Yogyakarta,Banjar,1001 to 5000 employees,1999,Company - Professional Corporation (PC),Banking,Finance,"Bank Central Asia (BCA), Bank Mandiri, Bank Rakyat Indonesia (BRI)",305.5,26089.3,"We need an Agile Project Manager with skills in Communication, Scrum, Project Management. Main tasks: Communicate with stakeholders, Ensure project delivery, Collaborate with agile teams."
Scrum Master,3.8,Matahari Department Store,Bandung,Balikpapan,1001 to 5000 employees,1995,Company - Private,Retail,Retail,"Indomaret, Alfamart",1145.3,11615.9,"We are looking for a Scrum Master skilled in Project Management, Facilitation, Scrum. Responsibilities include Ensure team productivity, Communicate with stakeholders, Support agile teams."
Data Engineer,3.5,Bukalapak,Pekalongan,Palu,1001 to 5000 employees,2000,Company - Subsidiary,E-commerce,Technology,"Tokopedia, Traveloka, GoJek",61.3,12681.8,"Hiring a Data Engineer experienced with Big Data, Hadoop, Python. You will be responsible for Collaborate with data scientists, Build and maintain data pipelines, Work with big data technologies."
AI Research Scientist,3.7,Garuda Indonesia,Salatiga,Balikpapan,10001+ employees,1997,Company - Holding,Airlines,Transportation,"Blue Bird Group, Astra International",50.5,44160.7,"We need an AI Research Scientist with skills in Algorithms, AI, Machine Learning. Main tasks: Analyze experimental results, Develop new AI algorithms, Conduct AI research."
UX Designer,3.9,Matahari Department Store,Bitung,Kediri,10001+ employees,2009,Company - Joint Venture,Retail,Retail,"Alfamart, Indomaret",637.2,98948.6,"We need a UX Designer with skills in Prototyping, Sketch, UX Research. Main tasks: Conduct user research, Create wireframes and prototypes, Design user experiences."
Agile Project Manager,2.7,Bank Central Asia (BCA),Pontianak,Padang Panjang,1001 to 5000 employees,2008,Company - Sole Proprietorship,Banking,Finance,"Bank Negara Indonesia (BNI), Bank Mandiri, Bank Rakyat Indonesia (BRI)",225.8,29115.5,"We need an Agile Project Manager with skills in Leadership, Communication, Scrum. Main tasks: Communicate with stakeholders, Facilitate agile processes, Collaborate with agile teams."
Back-end Developer,3.6,Indofood,Tual,Banda Aceh,10001+ employees,1990,Company - Sole Proprietorship,Food and Beverage,Consumer Goods,"Djarum, Unilever Indonesia, Gudang Garam",1201.6,96214.5,"Hiring a Back-end Developer experienced with Node.js, SQL, APIs. Responsibilities: Optimize server-side code, Develop server-side logic, Work with databases."
Deep Learning Engineer,3.4,Indomaret,Prabumulih,Padang Sidempuan,10001+ employees,1992,Company - Limited Liability Company (LLC),Retail,Retail,"Matahari Department Store, Alfamart",788.3,97567.8,"Hiring a Deep Learning Engineer experienced with Python, Keras, Neural Networks. You will be responsible for Optimize neural networks, Work with TensorFlow and Keras, Collaborate with data scientists."
Full-stack Developer,2.9,Matahari Department Store,Kotamobagu,Tangerang,10001+ employees,1996,Company - Joint Venture,Retail,Retail,"Alfamart, Indomaret",946.1,72955.9,"We need a Full-stack Developer with skills in CSS, React, HTML. Main tasks: Work with HTML, CSS, JavaScript, and server-side languages, Optimize full-stack applications, Collaborate with designers and developers."
Data Analyst,2.9,Unilever Indonesia,Batu,Lubuklinggau,5001 to 10000 employees,1990,Company - Partnership,Consumer Goods,Consumer Goods,"Gudang Garam, Sampoerna, Indofood",111.5,95608.8,"Seeking a Data Analyst proficient in Data Visualization, Excel, SQL. Responsibilities include Work with SQL and Excel, Create reports and dashboards, Analyze business data."
Business Intelligence Analyst,3.6,Sinar Mas Group,Gunungsitoli,Bontang,10001+ employees,1990,Company - S Corporation (S Corp),Conglomerate,Conglomerate,Lippo Group,1285.5,16016.0,"We need a Business Intelligence Analyst with skills in Analytics, BI Tools, SQL. Main tasks: Provide actionable insights, Analyze data trends, Create and maintain dashboards."
Front-end Developer,4.5,Tokopedia,Langsa,Banjarmasin,1001 to 5000 employees,2013,Company - Joint Venture,E-commerce,Technology,"GoJek, Bukalapak, Traveloka",419.1,58393.5,"Seeking a Front-end Developer with skills in HTML, Vue.js, CSS. Responsibilities: Ensure responsive design, Collaborate with back-end developers, Work with HTML, CSS, and JavaScript."
Machine Learning Engineer,4.5,XL Axiata,Parepare,Semarang,5001 to 10000 employees,2011,Company - Public,Telecommunications,Telecommunications,"Indosat Ooredoo, PT Telkom Indonesia, Telekomunikasi Selular (Telkomsel)",1456.6,11600.2,"Join our team as a Machine Learning Engineer. Skills required: TensorFlow, Deep Learning, NLP. Responsibilities: Develop machine learning models, Deploy ML solutions, Optimize ML algorithms."
Big Data Specialist,4.4,Garuda Indonesia,Depok,Banjarbaru,5001 to 10000 employees,2007,Company - Private,Airlines,Transportation,"Blue Bird Group, Astra International",1345.0,14966.6,"We are looking for a Big Data Specialist skilled in Big Data, NoSQL, Hadoop. Responsibilities include Develop big data solutions, Work with Hadoop and Spark, Collaborate with data engineers."
Big Data Specialist,3.8,Indosat Ooredoo,Manado,Mataram,5001 to 10000 employees,2005,Company - Holding,Telecommunications,Telecommunications,"Telekomunikasi Selular (Telkomsel), XL Axiata, PT Telkom Indonesia",823.4,5199.1,"We are looking for a Big Data Specialist skilled in Hadoop, Big Data, NoSQL. Responsibilities include Collaborate with data engineers, Work with Hadoop and Spark, Manage and analyze large datasets."
IT Project Manager,3.4,Lippo Group,Tarakan,Padang Sidempuan,5001 to 10000 employees,2006,Company - Subsidiary,Conglomerate,Conglomerate,Sinar Mas Group,30.3,60169.9,"Join our team as an IT Project Manager. Skills required: Leadership, IT Project Management, Scrum. Responsibilities: Work with IT teams, Manage IT projects, Communicate with stakeholders."
IT Project Manager,2.7,Ciputra Development,Bukittinggi,Palembang,5001 to 10000 employees,2013,Company - Professional Corporation (PC),Real Estate,Real Estate,,1274.7,54379.7,"Join our team as an IT Project Manager. Skills required: Scrum, Agile, Technical Background. Responsibilities: Communicate with stakeholders, Manage project budgets, Ensure project success."
Brand Designer,4.5,Matahari Department Store,Depok,Tasikmalaya,10001+ employees,1991,Company - Public,Retail,Retail,"Alfamart, Indomaret",1492.6,54675.1,"Hiring a Brand Designer proficient in Creativity, Brand Strategy, Graphic Design. Responsibilities: Create visual identities, Work with design tools, Develop branding materials."
Computer Vision Engineer,2.6,Indofood,Tanjungbalai,Kupang,10001+ employees,1990,Company - Limited Liability Company (LLC),Food and Beverage,Consumer Goods,"Sampoerna, Unilever Indonesia, Djarum",771.4,75093.6,"We are looking for a Computer Vision Engineer skilled in Computer Vision, Deep Learning, Image Processing. Responsibilities include Develop computer vision models, Work with image data, Use OpenCV and TensorFlow."
JavaScript Developer,3.0,PT Telkom Indonesia,Cimahi,Surabaya,5001 to 10000 employees,1995,Company - Joint Venture,Telecommunications,Telecommunications,"Telekomunikasi Selular (Telkomsel), Indosat Ooredoo, XL Axiata",665.8,82791.1,"Hiring a JavaScript Developer proficient in Node.js, JavaScript, React. Responsibilities: Develop applications using JavaScript, Optimize JavaScript performance, Collaborate with other developers."
Web Application Developer,3.2,Tokopedia,Subulussalam,Bekasi,5001 to 10000 employees,1992,Company - Public,E-commerce,Technology,"Bukalapak, Traveloka, GoJek",946.6,23923.8,"We are looking for a Web Application Developer skilled in Web Development, JavaScript, APIs. Responsibilities include Ensure application security, Work with JavaScript and APIs, Optimize web application performance."
Reinforcement Learning Specialist,4.9,PLN (Perusahaan Listrik Negara),Parepare,Jambi,5001 to 10000 employees,1991,Company - Limited Partnership (LP),Energy,Energy,"Pertamina, Bumi Resources",1298.1,34133.0,"Join our team as a Reinforcement Learning Specialist. Skills required: Machine Learning, Algorithms, Python. Responsibilities: Develop RL models, Collaborate with data scientists, Work with TensorFlow and PyTorch."
Brand Designer,4.3,Sinar Mas Group,Binjai,Bukittinggi,5001 to 10000 employees,2009,Company - S Corporation (S Corp),Conglomerate,Conglomerate,Lippo Group,123.3,26334.3,"Hiring a Brand Designer proficient in Graphic Design, Creativity, Brand Strategy. Responsibilities: Create visual identities, Ensure brand consistency, Work with design tools."
Web Developer,2.9,Sinar Mas Group,Gunungsitoli,Cirebon,5001 to 10000 employees,2012,Company - Subsidiary,Conglomerate,Conglomerate,Lippo Group,400.0,90036.8,"We need a Web Developer proficient in JavaScript, HTML, CSS. Responsibilities: Develop and maintain websites, Optimize web applications, Work with HTML, CSS, and JavaScript."
Robotics Engineer,4.5,PLN (Perusahaan Listrik Negara),Pagar Alam,Payakumbuh,5001 to 10000 employees,1990,Company - Private,Energy,Energy,"Bumi Resources, Pertamina",1362.1,28874.5,"Seeking a Robotics Engineer proficient in Python, Robotics, Control Systems. Responsibilities include Test and optimize robotics algorithms, Develop robotics solutions, Collaborate with other engineers."
UX Designer,2.8,Djarum,Magelang,Batam,5001 to 10000 employees,1999,Company - Non-profit,Tobacco,Consumer Goods,"Sampoerna, Gudang Garam, Indofood",32.8,67229.2,"We need a UX Designer with skills in Adobe XD, Sketch, Wireframing. Main tasks: Design user experiences, Conduct user research, Create wireframes and prototypes."
Machine Learning Engineer,3.7,Unilever Indonesia,Payakumbuh,Subulussalam,1001 to 5000 employees,2010,Company - Partnership,Consumer Goods,Consumer Goods,"Gudang Garam, Sampoerna, Djarum",970.8,98799.2,"Join our team as a Machine Learning Engineer. Skills required: NLP, Scikit-Learn, TensorFlow. Responsibilities: Work with TensorFlow and PyTorch, Collaborate with data scientists, Develop machine learning models."
Machine Learning Engineer,4.0,Bank Rakyat Indonesia (BRI),Ternate,Bogor,1001 to 5000 employees,2012,Company - Joint Venture,Banking,Finance,"Bank Mandiri, Bank Negara Indonesia (BNI), Bank Central Asia (BCA)",1449.3,28785.9,"Join our team as a Machine Learning Engineer. Skills required: Deep Learning, Python, Scikit-Learn. Responsibilities: Optimize ML algorithms, Deploy ML solutions, Collaborate with data scientists."
Machine Learning Engineer,4.4,Blue Bird Group,Tangerang,Pagar Alam,10001+ employees,2007,Company - Subsidiary,Transportation,Transportation,"Astra International, Garuda Indonesia",1347.4,41337.3,"Join our team as a Machine Learning Engineer. Skills required: NLP, TensorFlow, Deep Learning. Responsibilities: Develop machine learning models, Deploy ML solutions, Collaborate with data scientists."
Front-end Developer,4.1,Tokopedia,Sawah Lunto,Prabumulih,1001 to 5000 employees,2013,Company - Non-profit,E-commerce,Technology,"GoJek, Traveloka, Bukalapak",513.7,65480.3,"Seeking a Front-end Developer with skills in JavaScript, React, CSS. Responsibilities: Optimize front-end performance, Collaborate with back-end developers, Ensure responsive design."
UI Designer,2.5,Sampoerna,Prabumulih,Binjai,10001+ employees,2013,Company - Subsidiary,Tobacco,Consumer Goods,"Indofood, Unilever Indonesia, Djarum",1497.9,11570.3,"Hiring a UI Designer experienced with Sketch, UI Design, Adobe XD. Responsibilities: Collaborate with developers, Create prototypes, Design user interfaces."
Agile Project Manager,3.3,Kalbe Farma,Kupang,Madiun,10001+ employees,2012,Company - Sole Proprietorship,Pharmaceuticals,Healthcare,,167.9,73003.9,"We need an Agile Project Manager with skills in Project Management, Communication, Agile. Main tasks: Collaborate with agile teams, Ensure project delivery, Communicate with stakeholders."
